TransactionId,EmailId,Amount,TransactionDateTime,PaymentTypeId,Remarks,Info,StatusId
2981,vanggregory@example.net,11.36,2009-09-19 23:03:47.201337,5,Think painting reduce.,Collection also policy. Thus relationship lot enough natural. Team arrive anyone inside shake find.,6
2982,rebecca44@example.com,920.55,1977-02-14 17:09:07.149621,8,Describe operation.,Since factor sit election doctor place itself. Watch now price half find. Miss left prevent person.,2
2983,fevans@example.com,177.44,2020-07-03 00:46:04.343815,7,Growth take local.,Official him join whether poor pull. Outside unit kitchen dream scene Democrat woman.,2
2984,swatson@example.org,69.81,2000-11-19 21:57:24.437197,3,Fill sing week.,Dinner point social eat leg paper new check. Provide your worry project buy environment.,8
2985,qhoover@example.org,275.89,2003-07-12 02:36:12.984129,6,Physical still.,Good our case just then. Deal effect yourself.,4
2986,megan54@example.org,118.46,2019-04-26 02:30:01.517976,1,Trouble.,Air enjoy black care experience various white easy. Factor threat forward no within live go music.,1
2987,dcoleman@example.com,80.67,1997-11-25 09:33:36.154172,5,Whether mind agree.,Performance want large. Play my half seem.,7
2988,steven01@example.net,171.2,1991-12-07 23:34:32.771948,9,Trip peace us.,Report might maybe song. Cut cultural late must stock carry use.,8
2989,cfrazier@example.org,948.75,1983-08-25 17:25:21.146924,8,Whom happen election.,Behavior despite interest. Issue article amount. Much quality light stand.,7
2990,herreravanessa@example.org,392.81,1991-04-22 02:34:33.955034,7,Glass draw when.,Individual herself conference baby design talk. Method I any coach area answer fine.,5
2991,daniellele@example.org,639.86,2005-08-11 17:15:31.166711,2,Yourself share mind.,Training truth local image bit. Region none position resource.,4
2992,jenningsjanet@example.net,233.31,2023-12-10 13:42:43.134721,6,Pressure news.,Age move admit. Training art director recognize enough late.,6
2993,mwatson@example.net,346.59,2008-10-08 19:49:41.916762,4,Program market.,Everyone human range sell. History kitchen style world system.,3
2994,jessica60@example.com,561.92,2016-04-22 22:30:39.868950,5,Fine decision.,Leave save difference foot. Century spring wife admit. Against speak generation the carry.,1
2995,robin34@example.com,244.28,2010-05-05 19:48:02.682752,6,Hour.,Heavy part expect detail experience future.,3
2996,douglasapril@example.org,230.63,1988-04-30 02:44:46.677316,4,According song officer agent.,Environment of at agency. Behavior herself deal attack discussion dinner.,4
2997,parrishamber@example.net,900.35,1983-04-26 03:43:32.194992,3,Door eye beyond.,Ok interesting with can around. Floor stage maybe if food fight TV us.,6
2998,vwillis@example.net,185.07,2001-07-29 19:13:21.534758,7,Say the gun specific.,Lay activity live key boy even offer. Bit sit resource draw.,8
2999,soliver@example.com,337.3,1996-05-09 01:46:24.311046,2,Everything explain.,Discussion cultural memory capital worry. Expect they while your find car.,1
3000,yhanna@example.org,924.56,1982-07-09 12:48:47.755809,8,Position which himself.,Case bank join natural product prevent officer. Where finish too radio shoulder staff key computer.,5
3001,ohayes@example.net,466.43,1990-05-15 11:57:46.402386,4,Fund air.,I speech that news act. Left describe them receive.,3
3002,robert46@example.org,441.42,1998-10-21 07:23:18.935062,3,Impact recognize.,"Choice arrive stay leave carry her.
Suddenly safe guy stop service. Trade life memory state.",3
3003,gallowaymonique@example.net,475.4,1971-04-02 01:02:27.594537,3,Man police.,Prepare four property offer no true. Peace soon I. Teacher manager assume onto.,8
3004,pwalter@example.net,278.59,2001-04-27 22:57:43.394668,3,Culture parent begin.,Party soldier popular. Summer necessary front likely management. Clearly determine hour call.,3
3005,kweber@example.org,704.3,2003-06-16 06:34:11.577628,3,Fill bad.,Here everybody yet. Four attack every best short piece song bit. Again generation win himself.,6
3006,bweeks@example.com,954.78,2019-01-07 10:10:30.905832,5,Far magazine.,Upon shoulder win with model general. There special figure carry agency country.,7
3007,ebonymurray@example.net,923.91,1983-11-10 09:50:46.336666,1,Big.,Mind interview physical question. Window marriage professor wide hour.,5
3008,jasonlee@example.org,363.29,2001-03-22 04:27:20.396192,1,Top future according.,Same leader protect guess him. Rest prove crime peace he.,2
3009,dianahaney@example.org,656.36,2015-01-31 15:10:38.484150,4,Education party.,Second stock pay little. Environment matter four bit region. Born partner candidate senior.,3
3010,yrobinson@example.org,415.46,1988-11-13 12:00:51.113366,5,Bring mean medical.,Accept physical book risk. Hotel include appear art number degree or.,2
3011,coxtimothy@example.com,664.51,1981-06-24 07:30:50.308536,7,Wall to.,Pattern trial author tax where. Short discussion certainly pattern world fight about allow.,1
3012,emilywalters@example.com,945.32,2012-04-10 08:16:56.259346,4,Sometimes practice.,Base station better hope. Far all population.,4
3013,leetimothy@example.org,94.04,2018-04-28 23:59:43.290794,7,Stay chance.,Fine very involve only type someone. Million law maybe person. Executive mean represent.,8
3014,millerjennifer@example.com,82.3,1985-05-24 21:24:09.012658,9,Feeling race.,Citizen spend national possible approach cause number. Yard fund rise source soon.,5
3015,ghoffman@example.com,342.81,2013-02-14 07:56:41.084923,8,Quickly reveal.,Area receive couple. Notice pick soon. Range inside wide would remain parent himself.,5
3016,daniel14@example.org,186.51,2014-03-18 01:00:59.216986,3,Society talk side.,Another energy note message fish subject. Week support ten analysis bit receive. Build five feel.,5
3017,rebeccadyer@example.net,574.77,1975-09-01 20:55:36.922493,3,Brother also.,Once anything above your fight control. Specific serious pattern.,1
3018,brownsherry@example.com,513.05,1978-02-04 04:11:58.203285,7,Determine bit.,Future them system. They customer perform easy western professional officer.,3
3019,monique03@example.com,923.68,1997-12-27 06:28:04.184138,5,Mean decade nice.,So through spring certain road impact size music.,4
3020,marklopez@example.org,40.91,1978-09-28 13:21:54.102729,8,Grow upon left.,Several pattern rise every summer now anything. Late garden five offer million bad along.,5
3021,jdelgado@example.org,460.16,2000-11-03 10:26:45.238641,6,Fire maintain along.,Clear meeting prepare mind. Why but painting area. Fact close why focus race sense edge.,7
3022,ksmith@example.com,232.97,1990-01-01 10:29:39.503573,1,Congress campaign.,Wrong because budget future bar. Method if my rich. Try dream deep already my collection Mrs.,7
3023,scottfrank@example.net,96.84,1979-01-05 18:05:31.137693,6,Suggest heavy bit.,Deep third theory today. Thing hour class natural help produce town hand.,8
3024,stanley35@example.net,969.08,2000-07-16 07:39:12.070790,2,Often building newspaper.,Source full right herself task draw.,3
3025,jeffrey29@example.net,200.37,1998-11-14 09:52:54.351516,4,Worry serious hit court.,Others then free side. Item list police claim before writer. Baby city record.,2
3026,davidbutler@example.net,29.09,1992-05-22 13:06:39.326893,3,Here cup.,Usually talk federal. Meeting crime candidate within now especially author free.,2
3027,gmann@example.net,229.86,2010-11-09 14:45:24.839087,7,On reason.,Determine expect these success item type course. Woman effort anyone.,7
3028,charlene95@example.org,880.07,1984-08-27 12:10:05.230225,6,Six wish.,Concern speech old table home trip. Space third office partner thought painting happy.,5
3029,michael15@example.org,485.85,2008-07-29 16:29:47.602746,2,Perform break.,Above include of factor speech range. Deal sign avoid. Economy particular tell often them wind.,6
3030,sandrafox@example.com,493.37,2020-09-11 20:22:29.014615,4,Trade direction whom something.,Reach mind reflect blood. Art hair sing five.,4
3031,sean53@example.org,419.76,1970-09-22 16:45:40.975103,2,Off now board.,Local card husband time goal or determine. From serious share.,6
3032,alyssaglenn@example.net,578.43,2005-08-09 19:31:31.863903,2,Each little small.,System wait worker reality. Executive be piece small people reflect nice.,5
3033,jon75@example.com,13.93,2016-02-21 02:49:47.608227,3,White she.,Collection here trip answer expert low. Some myself indicate entire.,1
3034,tmiller@example.com,39.99,2013-12-14 15:52:27.285640,2,Human artist despite.,Be wear until five. Foot growth food consumer.,4
3035,davidbutler@example.net,173.89,1982-11-06 04:36:56.782607,8,Forget citizen side.,Stage rich minute discuss job sport without chair.,5
3036,latashanelson@example.net,711.98,1985-01-05 14:11:50.912978,9,Garden same past.,Possible officer actually. History Congress there. Against role shake bad issue land strong.,6
3037,katherine20@example.net,671.99,1998-02-16 04:14:35.449061,2,Later business.,Main account bring cultural show. Now turn newspaper guess upon. Hundred less player.,6
3038,rcarter@example.org,904.6,2007-08-28 01:55:33.641496,5,Clearly save.,Time community leave. Face movie significant television then. Than which employee garden.,4
3039,cardenaschristine@example.org,84.07,1989-05-29 08:14:36.027351,2,Ever practice.,Him no summer majority focus law manage. Poor wear indicate director feel line buy parent.,2
3040,william84@example.org,59.58,1979-12-20 16:31:31.013660,4,All play level sound.,Whole read already attorney keep require. Trouble guess operation house. News short not Mrs act.,4
3041,robertrivas@example.org,177.39,2005-06-09 02:16:01.158981,2,Reduce growth century.,Adult cover approach box force. Animal pull father high total. Ahead food spend.,6
3042,victorvega@example.org,870.34,2023-06-09 20:39:04.773310,3,Difficult development.,Question expect speak find finally a American foot. Believe receive environmental entire.,8
3043,hugheslaura@example.org,586.35,2000-04-11 04:20:34.298451,5,Artist popular top.,System find color professional produce sign. Recently eat look would side.,4
3044,shanecase@example.com,17.48,2003-07-31 07:47:53.028252,9,Record special number fact.,World production order nor stand take. Artist fill early yes rule fund too.,5
3045,jasonlee@example.org,285.84,1999-12-11 13:57:49.423977,2,Old police federal.,Suddenly send coach very identify challenge. Recently hour few.,1
3046,awest@example.org,819.19,1985-12-21 03:01:22.239630,5,Likely town bar.,Necessary cause tree. Their rich bed perhaps. Fly present hit whatever someone season.,8
3047,cjohnson@example.org,79.54,1975-03-19 16:21:51.221488,7,Whether base loss.,Write step especially into brother. Class him simple bank out.,4
3048,lcarrillo@example.org,345.74,1989-08-02 17:23:32.993979,5,Control expert among.,Indeed fire find base name care garden management.,8
3049,brianadixon@example.com,129.91,1990-08-16 08:36:27.626082,5,System system minute.,Medical heavy actually. Officer control land may challenge attention onto. Movie up seek sort trip.,2
3050,amber04@example.net,291.09,2005-08-22 11:09:21.699184,5,Moment color bank.,His strong live traditional. Sell want kind bill model same. Fight popular owner tend oil.,3
3051,hoganjohn@example.org,925.63,1978-06-16 09:46:13.080294,4,Culture individual watch.,Win fly price scene. Dog on measure tend still bag. Building can fact just final wear.,8
3052,vanggregory@example.net,339.41,2022-09-02 10:55:23.062634,3,Energy side.,She cold his almost record their. Well attorney pick also data civil beyond.,1
3053,herrerakathleen@example.com,957.54,2020-09-12 10:43:39.790844,7,Response.,Make especially money white under. Imagine two young action. Attack chair security conference.,3
3054,clarencesanford@example.org,849.77,1993-04-21 20:24:47.785038,2,Pick southern account.,"Decide wear audience research off. On mind campaign food.
Upon staff help.",2
3055,xvance@example.net,456.39,1986-04-02 15:27:40.987469,5,Could position young.,Maybe miss at rich. Court child single low nor skill better. Entire may everyone.,6
3056,christina96@example.com,986.09,1983-11-06 09:28:37.431752,4,Summer different arm must.,Mind friend war possible current hit measure. Recent under plan dream term society character.,6
3057,christian96@example.net,40.28,1980-07-28 21:57:04.558640,3,Car country American everybody.,Arm bring onto debate. Turn candidate marriage hope happy stage this.,6
3058,william49@example.com,751.96,1977-03-22 22:45:55.091795,3,Me Democrat.,Rich body history TV. Hot likely quickly eat interview whom.,3
3059,benjamin00@example.net,206.77,1990-02-20 17:59:00.094540,5,Risk kind here.,Seat body nation pick information imagine.,8
3060,jboyer@example.com,629.38,2020-08-18 05:53:01.899052,6,Very give compare.,Pretty culture could wind onto partner. Certainly its human list. Exist control manage chance list.,1
3061,james13@example.org,634.41,2011-11-12 03:55:36.722658,6,Poor say share your.,I player include nation.,6
3062,rebeccadyer@example.net,381.9,2022-12-11 05:29:57.231643,3,Last lay figure.,Participant everybody American discover argue especially big short.,4
3063,rlewis@example.org,532.93,2011-11-07 00:26:01.089252,8,Yourself source conference.,Never science two away who stand already. Sea star him recognize learn trial goal.,1
3064,lindajohnson@example.com,895.42,2019-01-30 17:04:20.438945,5,Career idea water.,Change church maybe say memory company. Those table month sure capital station.,4
3065,mary22@example.net,920.29,1997-07-04 20:45:20.385078,3,Southern want oil perhaps.,Reveal sport quite at travel pull consumer. Tv prevent race. Dream executive key policy.,7
3066,martinpierce@example.net,839.86,1997-10-11 04:49:45.731152,3,Strategy.,Simple leave senior inside party degree opportunity. Chair action situation natural break.,5
3067,xvance@example.net,381.67,2000-06-21 01:17:59.443555,1,Rise allow discover.,Speech follow civil assume system open. Begin fall loss central quickly foot.,5
3068,vvega@example.com,201.63,1974-02-07 05:51:08.314188,5,Yourself authority also.,Whole draw student career phone. Protect need sense person. Respond unit seat. Prove short maybe.,1
3069,gsmith@example.org,26.21,2021-03-29 18:25:07.563346,8,More short.,Election approach quite executive everything.,1
3070,victoria42@example.com,684.41,2003-08-15 17:18:47.168381,8,Reduce thing dinner.,Four side two. By above realize mother bed pattern but. Detail do difference although it.,3
3071,dwilliams@example.org,956.91,2021-03-19 10:19:49.256412,2,Customer realize subject.,Surface moment probably development hold true. Believe physical even according director continue.,2
3072,bbridges@example.com,592.6,1990-09-05 06:28:29.499739,7,State management.,Capital even few. Quality have bag same.,1
3073,warddeborah@example.org,889.9,1984-09-30 13:47:01.788185,6,Certain natural.,Perform ready management look. Thought charge building. Day any hit five true.,6
3074,pbenjamin@example.com,363.47,1985-12-17 14:59:32.919145,7,Knowledge for.,Billion whatever idea agent. Base hour director. Painting real about deep.,2
3075,robertpalmer@example.net,94.47,1997-04-26 15:16:34.047637,4,Career difference.,Rise forget move like. Approach country support this.,1
3076,walshlisa@example.net,752.88,1986-08-02 07:03:46.483197,3,Be bar environment character.,Consider act effort start. Expert occur join top new reflect.,4
3077,ulee@example.com,304.19,1988-11-30 04:07:56.860278,2,Produce gun show.,Play something area husband market. Four compare wind age. Which sit attack try own.,7
3078,jamie62@example.com,208.85,1981-03-30 01:34:40.142160,4,Blood store.,Method space oil budget treatment.,8
3079,santiagotimothy@example.org,280.12,1971-04-15 23:17:09.343430,4,Arrive attention career.,Must suggest including camera. Series wrong herself theory catch join evening movement.,7
3080,tonyanderson@example.org,887.09,2008-03-25 10:35:48.543688,7,Throw card at.,Somebody theory level late. Wind he to anything type.,5
3081,brandi98@example.org,786.65,1985-03-16 00:40:08.904755,9,Treat she property.,Tv right down although position share.,5
3082,dominique29@example.com,522.6,1997-06-29 02:36:10.229698,2,These into tend person.,Man same able memory film concern those admit. Similar TV nothing new.,2
3083,kristen03@example.org,207.13,2020-08-06 08:38:41.330214,4,Artist unit speech.,Which so program pass offer across bank. Few government moment. Force ok owner least executive.,5
3084,jacobchung@example.net,712.79,1986-03-24 01:02:53.583998,2,Company near.,Per sound begin deep evening from. Talk trade history star sort daughter bag.,1
3085,vburch@example.org,742.48,2011-10-02 01:42:26.061057,4,Toward begin side.,Change great environmental prove major subject. Rise less keep food east.,5
3086,lauren51@example.com,836.61,2000-08-22 15:38:09.427457,8,Claim nearly mouth.,Detail field approach deep until. Leave size together board wonder start lay.,4
3087,jenniferstewart@example.org,275.02,1989-08-10 23:42:31.077586,1,Matter north.,"There fire generation drug. Stuff structure class above bed.
Agree require operation me decade.",6
3088,claudiathompson@example.org,494.93,1991-09-22 11:11:56.915501,6,Degree.,Bag game hope PM office. Free run smile sure because. Bank sell affect someone quite design.,7
3089,amorgan@example.net,142.73,1995-10-09 11:29:55.088631,4,Under each.,Plant knowledge officer total window board fire. Article task movie would.,8
3090,matthewscharles@example.net,578.61,2015-06-07 09:29:00.062489,2,Natural author.,"Us effort item that garden.
While prevent art area even trouble language.",8
3091,stevebrady@example.org,70.84,2005-05-22 23:08:10.374667,4,Else bar always few.,Foreign word television perform various player but. Out good defense picture idea.,2
3092,bradyjoshua@example.org,258.46,1996-12-03 12:08:36.010405,2,Sing training west sea.,Heart according method smile actually. Water phone collection ever. Know attorney board office.,2
3093,mswanson@example.com,684.49,2003-05-15 00:09:52.591729,8,Value military owner.,Approach fill wide eat simply computer open. Economy campaign really figure.,2
3094,whiteheadnicole@example.org,707.06,2008-09-19 08:15:58.036276,7,Congress add.,Contain best product to. With huge thought child information remain. Describe blue protect society.,7
3095,mswanson@example.com,659.46,1981-01-03 03:47:30.539341,3,Especially inside effort.,Alone piece close country. However record company interview factor position source.,6
3096,burtonvanessa@example.org,785.15,1981-09-24 17:30:33.743277,3,Play late.,His apply pressure. Build growth its nearly. Billion necessary raise arrive.,5
3097,ronald30@example.org,685.19,2012-02-24 02:58:09.090787,3,Task site.,Already type onto wish pretty toward fall.,8
3098,heather48@example.org,798.04,1998-12-15 10:42:31.996319,1,Appear fight.,Another ok bill.,1
3099,schmidtmartin@example.com,146.85,1997-03-15 01:49:17.562851,4,Organization build.,Sound main generation. Dinner law our statement spend.,1
3100,martinezelizabeth@example.net,947.01,1999-03-02 02:00:36.401055,6,House share.,Indeed affect stand argue another.,4
3101,sherry23@example.org,619.69,2004-03-19 00:07:38.738133,9,Interest put.,Attention down our himself glass race crime the. Line mother teach responsibility player big.,7
3102,westscott@example.net,814.08,2001-12-16 10:26:10.931985,9,Memory seat sort.,Concern support court skill particular point require. Collection decide evidence social including.,2
3103,petersonchristine@example.org,391.33,2015-11-27 12:09:09.524491,3,Make be.,Happen wall state point. Change any worker poor price city bank.,3
3104,wesleysimmons@example.net,354.7,1978-06-02 00:28:04.113763,7,Whatever.,"Real truth special relationship effort.
Deal amount since shoulder. Mr each window morning control.",3
3105,ocarlson@example.com,102.62,1978-07-17 19:15:20.430379,9,Respond.,Majority building budget amount thank right against teach. Space you parent fund exactly election.,3
3106,owenmichelle@example.com,195.85,1992-10-11 20:38:40.869421,6,Knowledge professor yourself.,Nice still daughter stage. Design difference friend performance. Sea bad give of affect.,4
3107,anna90@example.net,41.59,2019-05-02 06:01:50.133777,3,Exist.,Foot great bit political. Tv old student thus. True three defense.,6
3108,xboone@example.com,987.44,1973-12-04 16:27:01.206730,2,Mind professional manage.,Professor understand our indeed. Discover get building person.,7
3109,brookesolis@example.org,357.03,2020-03-09 15:26:10.481100,6,Inside up.,Month social mouth four course despite rest. Congress west memory.,4
3110,nancy31@example.net,74.31,1989-03-23 06:59:18.737893,1,Always politics.,City change of bed. Share word assume soon buy by.,5
3111,nancy63@example.com,269.94,1981-05-29 23:20:27.456135,8,Million since.,Season indicate country modern which news technology book. Thank hard produce myself economic hear.,5
3112,alexander55@example.org,344.62,1976-04-28 03:18:52.140649,3,Simply check increase.,Answer hot production rate down. Ever possible upon. Condition movement discuss individual.,8
3113,danielweiss@example.net,387.31,1971-05-13 00:56:54.953325,9,Girl.,Recognize management long painting benefit this.,2
3114,hamiltonandrew@example.com,358.4,2005-01-23 08:50:59.789931,8,Probably even.,View machine street identify number Democrat test. General science respond since cup let that.,2
3115,michael48@example.com,351.05,2019-09-05 13:17:28.886149,1,Form attack.,Money deal purpose. Reflect region film grow quite executive.,6
3116,michelepeterson@example.com,863.8,2008-12-01 17:40:22.154483,1,Test be.,Writer you list teacher particular sister. Much thank own music.,7
3117,cynthiamills@example.com,233.65,2019-08-13 13:47:52.028957,9,Easy whole cause.,Practice four only several gun inside. Woman citizen tell.,2
3118,amber79@example.com,933.47,2012-08-22 03:54:24.205942,2,Less or family.,Call road receive send bed. West mention indicate. Look student fine yourself.,8
3119,barbara32@example.net,704.08,2009-03-29 04:28:23.726748,3,Quickly president.,Fly be most idea. Country involve story wonder by perform. Child far simply right tree hotel.,5
3120,carlosoneal@example.org,604.38,1992-12-21 01:37:42.722886,8,Section impact.,Teach discover test air. Thought every sit these really. Newspaper bill hot way.,5
3121,gibsonadriana@example.com,824.99,1988-05-19 16:48:02.158037,5,Keep baby mind.,Product young fast Mr attack window. Assume food minute tough quite blood.,6
3122,zbarnett@example.net,961.02,1980-09-10 14:16:29.496751,3,Activity mean card.,Yard easy remain later chance toward soon. Society thing building major.,6
3123,michele63@example.net,877.22,1978-02-19 00:35:43.321507,3,Site ability.,School dark wind process. Myself represent concern girl foreign.,4
3124,mcgrathrichard@example.org,217.41,1990-12-09 13:06:51.070611,7,Group detail.,Eye east use allow father environment. Think generation example able line body fall.,8
3125,david00@example.net,17.85,1972-03-24 16:21:29.994424,8,First feel dream.,Put will even beyond chair a open. Avoid shake price information sport school tough.,3
3126,cynthia07@example.com,499.55,2000-08-26 13:52:29.509893,5,Economy across shoulder.,Break strategy old person. Take everything discuss black worker country care.,7
3127,nguyenrobert@example.org,447.98,1995-07-22 09:19:13.439677,2,Degree himself more.,Against until tend here. House popular keep most face look. Leave watch voice purpose.,7
3128,jacob48@example.org,68.08,2023-01-27 23:29:56.129086,2,Present card.,Section wrong major strong. Son away while. Town onto mother your best put.,3
3129,jessica60@example.com,565.46,2010-07-28 20:38:49.057235,7,Yard degree him.,Audience attention agency despite color. Official land person political former hair.,7
3130,francisco31@example.net,672.91,1987-03-27 15:20:29.592947,3,Military television development.,Always recent down true practice school. Mission protect send white.,2
3131,dpowell@example.org,352.36,1979-09-18 12:05:29.406303,5,Fall discuss.,Expert final picture out create hot. Dog left agent something fish share.,1
3132,eugene25@example.com,502.67,1974-08-08 22:25:40.010543,4,Charge hear.,Player success knowledge investment. Clearly official exactly eight thus bank art.,6
3133,xrivera@example.org,358.94,1986-04-01 04:03:52.415855,8,Mrs.,Theory amount buy garden change culture. Happen art less floor gun.,5
3134,daniel14@example.org,800.18,2019-11-17 21:59:33.663519,6,Worker worry.,Health such season argue bar. Win news several very environmental national.,2
3135,rebecca69@example.net,220.51,1977-01-01 07:41:43.979833,5,Soldier writer share.,Road institution edge. Be institution their because range.,7
3136,mswanson@example.com,736.63,1990-08-19 02:24:28.227096,5,Boy size attention.,Week all happy pay market stage upon character. Understand later music medical.,8
3137,olsenbrandon@example.com,339.0,2015-09-25 02:19:56.933273,8,According book.,"Official education citizen focus.
Chance television husband already key until. Bad blue media.",8
3138,leecrystal@example.com,25.59,1998-12-06 19:15:07.383353,7,Exist black guess.,Report your none allow yes hold. Matter main send job.,6
3139,fperez@example.net,647.68,1997-07-16 19:04:26.966579,6,Fill put.,Dog join chance west star after. Throw especially rate happy picture sense development.,4
3140,mmorales@example.org,248.58,1983-08-23 07:02:54.502594,5,Event their of.,"Growth impact reflect.
Line same care. Threat so health reason can themselves create.",8
3141,jacob48@example.org,747.41,1972-10-21 15:14:50.028919,4,Parent leader history toward.,None tonight civil speak history. Together day draw past his least without. Western voice fill.,1
3142,lynnprice@example.org,424.59,2021-01-22 09:34:11.890552,9,Environmental project similar.,Return door another address. Similar quite exactly something gun so way. Evidence continue career.,4
