TransactionId,EmailId,Amount,TransactionDateTime,PaymentTypeId,Remarks,Info,StatusId
3971,martinstephen@example.org,968.81,1986-09-18 00:22:26.780013,7,Make nearly institution.,Say nature Republican girl. Husband hard across up.,6
3972,raymond26@example.org,235.23,1996-06-29 00:09:01.978244,8,Street scene.,Attention career four use.,2
3973,anewman@example.org,506.25,2017-10-10 10:41:59.893829,3,Out occur.,Investment consider fast pay place prove out.,4
3974,pjohnson@example.com,506.36,1976-12-22 00:07:33.988472,2,Computer medical both.,Street author project account. Movement across modern camera allow future.,2
3975,keithherrera@example.net,297.03,1972-05-17 18:58:07.369280,9,Light down open.,"Particularly order radio upon.
Nor yes describe do. Coach human you huge before back.",4
3976,ebonymurray@example.net,976.97,1981-05-30 14:28:00.444753,8,Though law.,Perform remember baby vote south.,2
3977,francisco31@example.net,888.98,1982-05-11 21:01:30.433385,5,Once floor.,Fast little certain show property cultural. After walk air exactly art.,5
3978,david04@example.net,154.44,1981-08-19 09:12:13.781070,6,Across society treatment.,Owner eight however center. Very service image half oil have. Pull may water term move.,7
3979,matthewramirez@example.net,388.93,1972-04-13 09:40:17.596310,2,Church development.,Fight off also instead modern few however present.,7
3980,yrobinson@example.org,665.28,2018-09-26 08:24:24.502714,3,Apply important science.,Yourself half anything environment. Many information certain us catch thought major.,1
3981,elizabethwheeler@example.net,834.15,1996-12-27 10:20:32.854545,6,Rest when.,Attack capital court spend. Stay tough character charge rule star.,2
3982,aguilarchristina@example.org,919.66,1972-09-30 02:46:06.683660,1,Give property.,Five hope control next religious.,4
3983,haley20@example.net,263.96,1987-06-13 05:34:20.061996,8,Relate society.,Behind other cell practice develop account. Live myself professor after your language high degree.,8
3984,smyers@example.org,725.55,2016-10-01 12:33:04.519835,1,Than piece.,Model service attention middle grow bag here. Life rule truth old. The senior total owner item.,2
3985,megan32@example.net,974.59,2020-01-18 13:58:36.322504,9,North present certain.,Form big to. About measure then so surface bank stop. Leader low else to trade type bank history.,2
3986,creed@example.com,249.58,2015-11-29 00:56:31.963462,7,Change audience out.,Reduce investment wind machine start shake far support. Indicate out answer series.,5
3987,david43@example.org,760.82,1972-06-29 08:38:32.562743,4,Most scientist.,Myself general build list skill executive. Health fight dream as prevent return stop.,1
3988,ljones@example.com,364.3,1997-10-30 10:34:08.541297,2,Receive industry network.,Table top beat court federal before. Go two oil.,4
3989,qlopez@example.net,386.03,2020-07-19 17:28:31.074803,1,Apply score prove.,Wait address factor century. Toward reason speak value. Analysis run enough.,5
3990,jennifer90@example.com,83.08,2008-07-29 01:29:05.723315,6,Return past.,Perhaps live well perform street economic player speech.,8
3991,ricardomoore@example.net,354.23,1972-09-20 07:57:44.074326,8,Television range last.,Able official share them wait. Trouble treat machine deal to.,2
3992,aaronharper@example.com,532.04,2011-07-22 12:07:19.492550,2,Wait community never.,Number skill must word recently charge grow whole. Wonder here analysis item similar.,6
3993,lauren51@example.com,216.25,1976-02-11 17:25:56.059450,5,Star fast.,Political sea enjoy entire maintain. Take someone agree scientist throw hit east.,1
3994,greenethomas@example.org,482.82,2019-12-12 04:03:50.197538,4,Mission wrong suddenly.,"Cold evidence similar.
Five least development ask information think. Significant simply ahead.",3
3995,mark46@example.net,247.53,1996-07-10 18:37:53.541659,8,Tree area hour.,Cover break bring medical trouble. You reflect there skin.,3
3996,uwatson@example.com,665.88,2017-03-16 22:25:28.059059,6,Sort position.,Minute open exist car us. Life into road front security several. Partner board hear want.,1
3997,vvega@example.com,822.04,2003-02-12 02:17:20.997229,4,Last newspaper.,Recently try scientist detail majority career budget. Summer ask attention authority.,3
3998,martinstephen@example.org,620.88,1981-03-04 11:46:19.042135,8,Stay threat in.,Choice customer strategy nature base. Wait themselves rich.,1
3999,michelle64@example.net,242.98,1978-08-31 12:56:42.771445,9,Society goal our.,Speak maintain your its and. Commercial wish read report. Find indeed place pick.,7
4000,juliajacobs@example.net,276.3,2016-01-28 05:17:49.009280,1,Technology power economy.,Economic attorney forward but through. Contain husband figure turn check.,6
4001,allisonwilliams@example.org,318.69,2022-07-19 11:09:50.187620,1,Fly would responsibility.,Hot again section check site husband.,5
4002,alexiszavala@example.net,765.13,2015-08-15 16:34:46.706335,2,Bank however personal.,Property white new. Focus note his save. Movie entire page various send available recognize.,8
4003,barnesjeremy@example.org,151.52,1982-04-28 06:52:33.608503,2,Herself beautiful.,Measure character scene cost. Close play enjoy specific act other especially watch.,1
4004,wilsongabriel@example.org,312.14,1985-10-07 01:20:46.766643,1,Audience.,"Black practice job.
Mind last several give. Unit easy father strategy understand season.",6
4005,gclark@example.org,885.71,1975-12-08 11:41:03.201338,5,Law large.,Manager authority safe himself sound project mind according. Hair leg ok store often spring mother.,2
4006,cheryl86@example.net,235.3,1980-09-22 02:47:04.935728,7,Family large whatever.,Avoid civil author know. Really special dark woman describe. Sign order traditional door.,1
4007,brookegillespie@example.net,683.21,1979-10-06 06:30:55.500651,4,Nearly inside cultural.,She alone leave production. Another material difficult next. Art similar owner down leader detail.,8
4008,justin62@example.net,17.25,2022-07-05 06:33:23.161351,1,Late process.,Lawyer speech husband military cultural.,2
4009,davidthomas@example.com,183.76,2010-07-11 02:28:17.457928,1,Since idea.,True oil fine young beat.,7
4010,pedro60@example.org,406.06,1988-01-20 18:41:48.681611,3,This stay.,Marriage standard small into. Across onto week. Unit morning make nation.,7
4011,herreravanessa@example.org,635.17,1981-12-05 03:32:50.770980,4,Myself customer ahead stage.,Whole record hot floor real occur. Really happy off seven.,8
4012,ywilson@example.com,498.95,2012-05-29 08:00:47.537232,5,Final.,Would senior common trial case network. Offer adult long cost.,5
4013,mcdanieljason@example.net,67.21,2003-03-09 08:37:57.333174,8,First responsibility near.,Whose modern front understand table. Central local adult out admit.,4
4014,rsloan@example.com,659.86,2014-07-24 19:05:08.886764,4,That city mention.,Maintain rather page firm picture. Defense throw through practice. News matter anything range.,7
4015,michelepeterson@example.com,831.43,2018-05-05 20:10:25.486467,8,Far worry.,Fly media natural note goal again new decision. Dinner do seek raise.,6
4016,martinezkaren@example.org,239.44,1983-05-06 02:38:43.885386,2,Keep.,Fall security nature three. Staff back most interesting. Apply order stay miss little college one.,5
4017,creed@example.com,909.86,1997-10-31 15:40:12.010774,9,Large land.,Decision under phone he skill. Result buy ahead series response. Difficult show usually care act.,5
4018,jessica60@example.com,912.83,1996-12-01 11:01:25.936603,8,Notice significant back.,Increase notice cultural middle worker hundred say. Course employee sell might western.,7
4019,kbernard@example.net,839.85,1996-09-09 06:56:00.550929,6,Even lawyer clear.,Discussion fly eight shake doctor. Team two piece garden.,6
4020,robert33@example.com,49.64,1979-10-26 20:36:55.150815,4,Often measure.,Tell more argue. Eye responsibility return personal born reality various.,4
4021,sabrina20@example.org,400.88,2017-11-22 22:26:12.676377,4,Fall window positive.,Play scene report argue instead weight structure.,7
4022,hbradley@example.com,432.62,1981-07-17 06:03:35.539074,2,Mr.,Enjoy page well boy myself. Clear war use important final professor sometimes current.,4
4023,joshua15@example.com,643.39,1979-09-25 19:31:09.640835,5,Move these game.,Stage thing personal tell sure send. People ahead almost realize discover then yes.,2
4024,ricardomoore@example.net,261.24,1991-07-24 11:22:05.187364,1,Agent business after lay.,Economic structure each perform heavy. Edge station much sport. Window look instead common.,1
4025,molly60@example.net,182.87,1996-10-15 00:24:07.884419,7,Bag bar.,Coach save financial shake wear. White indeed perhaps management.,1
4026,heather81@example.org,126.26,1976-01-20 00:45:59.667369,1,Take history suddenly.,Today position force. Stuff order under listen day natural keep.,7
4027,zunigapatrick@example.net,176.17,2019-12-12 14:41:58.034517,3,Forward well same.,Pretty trial who several. Once her not morning artist approach money.,4
4028,jimenezbryan@example.net,113.86,1979-08-14 19:19:57.618147,5,Simple civil season.,Feeling attack pay. Southern four couple ball practice.,1
4029,grice@example.net,251.3,2015-09-20 13:33:48.849349,9,Operation push.,Particularly but last positive might measure expect. Defense point street garden task entire soon.,1
4030,ebonymurray@example.net,788.18,1988-06-24 22:59:26.127893,7,Reflect than others.,Could analysis what religious. Either effort daughter discuss with. Subject campaign next over.,7
4031,collierjohn@example.net,64.28,1999-08-15 14:12:10.595051,7,Plant defense.,Sound movement professor student boy happy. High run form evidence matter.,1
4032,kelsey98@example.net,464.34,1987-12-02 08:28:27.303456,6,Region worker.,"When property lead run.
These young kind partner degree big.",1
4033,sean62@example.org,257.35,1999-05-27 16:19:36.043606,5,Fact join case.,Spring save into garden use.,1
4034,rasmussenvictoria@example.com,570.79,1981-11-11 11:26:48.149489,5,Production certain modern trouble.,Turn head head onto career condition. Nearly sing up color painting.,5
4035,rebecca80@example.org,758.9,1993-06-23 18:27:44.299686,6,Present particular.,Range maintain per home something poor small.,2
4036,medinatammy@example.com,781.36,1987-05-16 17:47:50.733496,7,Husband house not.,Later last accept personal. Evening describe amount control will address own.,3
4037,allenford@example.net,302.83,1974-04-10 16:03:35.667872,6,Feel despite.,Control determine story community agree everybody. Leave above tough say work deal use paper.,2
4038,rallen@example.net,821.76,1970-09-27 08:23:49.044782,9,Nation management house.,Main admit present each then. Simple leave tough occur. Thank economy can serious join.,1
4039,melissa83@example.net,176.06,1982-04-11 20:28:26.890684,5,Black me feeling.,Recognize debate price remain. Unit identify discuss outside its yourself. Method minute about.,2
4040,scott82@example.com,422.25,2010-12-31 21:32:40.087420,6,Relate report.,Land born peace begin money. Training media program push ask its western whether.,5
4041,whiteheadnicole@example.org,249.45,1999-11-24 12:12:38.299688,7,State member.,Pressure assume drive themselves. Try star country mission goal line catch.,5
4042,stephanie87@example.com,474.12,1978-06-29 18:29:17.862327,4,Enough.,Risk seek ability father dark occur.,3
4043,rebecca24@example.org,699.49,2022-08-25 13:38:43.405137,4,Operation.,Culture factor travel feel walk almost police. Write whether surface remember.,7
4044,bcoffey@example.com,506.43,1991-02-08 23:16:13.176815,9,Real head.,Treat north run receive I. Within system enter treat police.,8
4045,michelle64@example.net,741.48,2010-08-26 22:09:19.951635,5,Someone condition heavy.,Another another gas. Professional game role choice. Particular meet put late wrong accept off.,2
4046,mendozadonald@example.com,573.24,2012-07-06 14:16:09.691804,7,Bit discover.,Believe citizen space actually itself.,1
4047,ojohnson@example.net,417.31,1975-11-24 15:28:40.884157,8,Bed especially generation sea.,Almost own million stock. Gun professor son feeling party.,6
4048,francisco31@example.net,954.07,1995-08-26 09:12:29.208619,2,Company you.,Easy scene audience task present receive too. Tax trouble remain responsibility system.,3
4049,william12@example.net,140.3,1978-03-29 08:23:11.646251,8,Have evening police.,Court resource world reach. Test member hospital nor.,1
4050,sarah58@example.org,377.66,2014-12-21 05:06:47.420742,1,Technology response summer summer.,Hear sister organization response there.,6
4051,robert46@example.org,692.89,1998-05-23 18:16:45.161898,1,Police such source.,Shake ask blood money effort bad. Forward involve senior environmental direction.,4
4052,dcoleman@example.com,346.62,2010-03-07 02:09:08.056128,5,Sort purpose election media.,"Democrat collection his money. Draw speak any.
Quite to style. Whatever Republican add.",2
4053,sarah58@example.org,237.08,1976-01-12 00:52:02.354649,4,Food picture there.,Body thought unit third rest across fast. They whole where side.,4
4054,aaronharper@example.com,611.53,2002-03-01 00:25:47.593140,4,As until.,Result design character process economy value until. Join instead computer police.,1
4055,roblesronald@example.net,635.23,1988-02-02 10:01:41.670925,9,Control everything although.,Company drop ready it. Carry degree form six turn. Wear up receive woman a crime task.,4
4056,robert69@example.net,389.75,1995-10-24 06:48:52.609771,6,Action billion.,Plant final somebody real. Side someone try religious out above. Find perform development radio.,6
4057,andrew71@example.org,251.69,1982-09-15 13:01:33.066002,1,Court happy occur.,Discussion cold operation family technology follow television. Medical piece able.,4
4058,migueldavis@example.org,890.73,2018-06-12 09:26:25.113699,3,Him item back anything.,Character nothing rock compare long short. White off outside side.,4
4059,ewhite@example.com,544.05,2012-09-27 12:25:23.943552,9,Wonder think.,Thought will process reveal. Million nothing executive follow perform anything edge.,7
4060,ymathis@example.org,165.91,1977-11-19 16:38:25.035301,6,Order physical few.,Sport official interest agreement deep including allow may. Our response accept miss key attorney.,7
4061,owyatt@example.net,212.53,1987-01-17 02:16:24.645465,6,Go nor at ahead.,"Imagine though agreement either offer.
Check soldier how body. However result meet road.",4
4062,bortiz@example.com,92.69,1990-05-19 07:36:36.287435,2,Anyone three thought million.,Police put structure field capital. Choose concern yourself.,4
4063,zhangbradley@example.net,460.22,2005-07-13 14:22:59.531920,5,Lot nice view.,Although poor while share rule movie.,3
4064,brownvalerie@example.org,129.96,2001-09-18 15:11:19.031274,8,Technology floor state.,Address far notice wear. Event although figure value beyond bar threat.,5
4065,solisvickie@example.org,549.49,1977-06-21 10:34:24.436736,5,Media week possible.,Father yes trip forget we front product. Traditional indicate another get necessary must.,8
4066,wilsonalexander@example.org,628.53,1992-08-12 08:08:40.980435,4,Test fine.,Fill body hair appear assume newspaper. Later then buy product admit development.,3
4067,dawnbullock@example.net,632.17,1979-12-19 04:27:50.788795,9,Alone study.,Relate behavior must quality just light.,8
4068,brittanyhart@example.org,569.02,2015-08-28 17:43:14.636728,2,Impact ground world argue.,Expert senior little large range. A spend able thousand issue.,5
4069,davisteresa@example.net,390.75,1986-11-19 18:02:28.225020,4,Plant face wear.,Wear necessary the as parent TV recognize. Middle story camera live what plant.,6
4070,amber79@example.com,171.99,1975-08-10 00:54:26.768187,5,Every take.,Quality land money few guess. Response bed wonder these. Million six guess later student.,6
4071,danielmartinez@example.com,891.73,1988-12-26 19:42:41.332215,8,Mouth outside he bring.,Fly day college live per nearly share care. Relate term past leg wish their.,4
4072,frank65@example.net,811.57,1989-12-06 11:03:45.223754,4,Local next glass.,Her trouble piece home both realize responsibility.,3
4073,bryan94@example.net,922.02,2008-03-04 22:46:14.437212,8,Value modern.,Dark cover even section force prove they. Join relationship development describe hotel beyond.,6
4074,uwalker@example.net,534.97,1994-10-27 16:14:32.307284,1,Mother yard newspaper.,After spend economy avoid else. A style different international wonder player.,3
4075,hunterthomas@example.org,193.46,2005-05-19 15:00:47.981130,8,According activity give.,Not charge campaign factor by. For race us nation spend bit war.,1
4076,rayadrian@example.org,353.67,2005-11-04 19:45:54.642941,7,Night measure include.,Mr performance president government activity sport since.,2
4077,ksmith@example.com,125.0,2002-09-19 18:02:40.375542,5,Not specific five threat.,Focus above result star we effort mention. Ask guess draw way conference treatment.,8
4078,stevebrady@example.org,279.77,1996-10-27 15:22:29.943801,7,Quickly practice.,Data total kid public to. Car along choose star issue realize play.,7
4079,jonathan37@example.net,413.18,1984-11-09 03:46:56.951361,1,From wrong guy.,Drive head ahead including. Marriage travel two heart board table discuss.,4
4080,brian25@example.org,522.6,2000-01-09 16:03:54.378257,9,List the.,Current order series collection. Ready pretty about forward standard.,2
4081,bradyjoshua@example.org,294.79,2021-09-28 10:45:11.083358,7,Physical weight eye.,Group smile them. Whole nature raise follow.,3
4082,deborah64@example.net,298.35,2019-10-28 02:37:42.351542,3,Cut statement soon.,Thank reveal trip prove fall garden. Read community late again.,8
4083,derrick03@example.net,828.97,1971-04-08 05:13:19.094903,8,Explain suddenly.,Collection development young. Man speak medical sister of stuff seat. Its attorney others day.,8
4084,jacquelinebradshaw@example.net,777.98,1999-07-02 10:03:18.154433,4,Instead risk.,"Out quite space gas reveal. Black focus himself mean institution.
Seek security argue civil check.",1
4085,gclark@example.org,344.53,1976-02-13 04:35:39.212565,1,Feeling show adult door.,Main the professor we turn weight. Medical usually argue international.,1
4086,keithherrera@example.net,752.52,1987-05-14 23:41:34.151271,3,Full remain reveal.,Then quickly decision return. Budget less garden use.,6
4087,eugene25@example.com,699.0,2018-11-11 20:42:39.730872,3,Film officer anything.,Moment just so our early. Position drug be fine.,4
4088,brookegillespie@example.net,311.83,1974-10-20 06:28:31.373743,1,List edge mind.,Suddenly board mean yeah tell shoulder civil west. Management ready matter public white thought.,7
4089,qcastro@example.org,574.69,2015-06-16 09:23:30.813474,2,Think any line.,Somebody every theory report loss. Indicate evening area well poor.,1
4090,joshua15@example.com,730.3,2019-01-21 23:24:10.124002,8,Effect save.,"Body special seven can. Rather window from stay.
Buy national think also significant cut model.",6
4091,jdelgado@example.org,955.7,2015-07-17 22:00:45.906337,9,Everybody ago around.,Method despite make onto.,1
4092,sneal@example.com,298.04,1996-04-12 11:28:56.124831,5,Lose city as.,Attack happen him course trial interview deal. Set reach idea ok people act.,7
4093,kristen03@example.org,653.73,1984-11-18 06:01:34.134532,9,Find go.,Unit skill face onto. Mouth month professor physical serve.,5
4094,william84@example.org,426.03,2006-03-23 05:48:12.081743,3,Tv raise hair.,Fish feeling pattern want decade director consumer. Most top sit always since.,6
4095,edwardmullen@example.net,702.44,1993-01-18 10:00:56.803102,7,Hope fine.,Behavior act become glass. One soon yet here.,1
4096,catherine33@example.com,699.24,1971-05-28 03:58:16.351380,2,Body rate.,Road natural subject society. Argue player concern these. Analysis knowledge purpose.,7
4097,bryan93@example.com,38.6,2001-06-05 21:58:05.773567,4,Expert performance.,Move current cover within. Her there skill require development.,3
4098,ewhite@example.com,736.27,2008-05-17 05:34:06.126423,1,News then star.,Eat too already poor. Say compare partner war economy mind.,6
4099,tammy10@example.net,193.86,2009-01-28 11:58:54.012568,8,Why home.,Water federal agency less specific. Probably financial let play game top. Know medical live walk.,7
4100,lwhite@example.com,83.52,1981-05-19 16:51:06.036880,3,Western important amount.,Within kid charge seek. Million some area resource size woman.,7
4101,nli@example.org,544.18,1998-09-15 13:15:46.711400,7,Service letter her.,"Human commercial from attack.
Over policy peace operation. But employee east anyone yeah event.",6
4102,gjoseph@example.com,29.31,1994-08-14 20:13:52.906969,1,Down some.,Perhaps stand take try send soldier unit. Minute church study quality however institution nothing.,8
4103,sheenamccall@example.org,151.74,1972-09-14 20:36:01.310842,2,Pay development.,Might everybody very coach onto fly spring. Key thus life wrong.,5
4104,andrew63@example.org,876.39,1975-06-18 02:08:58.897769,8,Quickly thousand information.,"Idea crime window boy soon operation.
Name mean program. Share network home Congress wish.",2
4105,gsmith@example.org,249.91,1985-09-15 21:26:19.097395,9,Join brother.,"Study after nature agent.
Impact that skill lawyer book. Role shake everybody above.",7
4106,jacobrhodes@example.org,588.49,1981-05-25 16:17:11.349913,1,Here.,Federal design whom thing lay option gas. Stand various study hear trade middle walk.,1
4107,saundersloretta@example.org,637.63,2020-04-02 16:59:07.037473,6,Now friend not.,Great blood we specific citizen. Wife state likely business agent defense.,2
4108,william84@example.org,770.21,1982-05-25 06:07:35.021831,8,Discuss environmental democratic.,Sense early mission lot general personal. Nothing family size each adult. Reason team class expert.,6
4109,alexandermills@example.com,747.64,2001-12-12 23:38:43.476627,7,Common will citizen.,Possible gun family wonder walk central both. Politics put doctor public strong. Of right hand yes.,7
4110,ronald80@example.com,548.56,2019-08-17 10:49:08.548122,4,Focus after.,Be probably poor central thus simply. Fear under may former. Leave provide box tax before.,4
4111,meyerkatrina@example.com,408.38,1971-04-02 05:56:05.118945,2,Gun soon.,Civil eye young. Instead fear voice often audience. Use here change leader maybe consumer audience.,8
4112,gibsonadriana@example.com,373.05,1980-11-06 11:39:34.180285,9,Management anything fund.,Us name front hold about. Than across southern but team. Two maybe modern determine.,4
4113,katherine21@example.net,109.47,1988-09-27 01:53:54.616522,3,Choice step develop.,Moment for hair grow. Ask move rock kind interest check indeed.,3
4114,hollanddanielle@example.org,287.99,2020-08-18 03:14:37.086867,8,Understand one.,Phone next military determine. Performance medical pull wonder throw.,3
4115,jamie62@example.com,432.44,1977-08-20 09:08:47.906785,5,Staff understand past.,News class attack bring approach structure first.,1
4116,rebecca24@example.org,330.85,1983-08-14 02:31:36.501942,2,Exactly list.,When power side too happen. Tax receive provide mother herself actually.,4
4117,tbrown@example.net,904.64,2022-01-07 10:45:14.234470,3,Article make gas.,Body break over. Reveal professional recently.,8
4118,kelseymorris@example.net,579.59,1994-03-11 10:18:12.632230,5,Low son.,"Loss surface will eat. Follow who appear worry.
Despite participant rock year.",6
4119,xvance@example.net,485.01,1991-03-26 15:35:49.558861,6,Game analysis modern.,Official happy service whose explain deal. Your machine cost participant most institution.,6
4120,amber04@example.net,797.82,1986-05-14 14:55:32.949059,3,Animal feel.,Huge performance add account likely play less. Soon myself just more word together.,5
4121,monicataylor@example.org,327.61,2002-01-07 17:20:48.765992,3,Carry operation.,Several the light customer effort. Cultural go art how night authority.,4
4122,wrightjose@example.com,408.69,2002-02-05 13:42:17.757380,1,Present maybe total.,Dark visit school teacher. Especially card outside live image. Pressure city interesting.,7
4123,webbdonna@example.com,799.57,2014-04-27 15:15:58.204360,9,Study rock you.,Occur under rock news later writer first. According interview after move.,5
4124,harristara@example.com,960.03,1985-01-17 07:42:46.849921,8,Not until because.,Plant cultural why employee fast scientist war. Soon material know not.,8
4125,jdelgado@example.org,551.38,2022-02-12 15:01:56.024791,4,Chair raise evidence.,Like while drive where small during left. Scientist course million seem ever.,2
4126,lisamorgan@example.org,506.88,1977-08-06 22:23:20.574134,8,Cost like example.,"Site author likely all help example detail.
Beyond western relate community.",7
4127,russomatthew@example.org,329.8,2017-08-06 23:27:27.996131,2,Tonight assume manage.,General likely respond last last positive record science. Worry ask enter add house game.,3
4128,carlosspencer@example.com,169.15,2003-05-24 20:03:13.304116,3,Star two card.,Could there gas voice. Large they benefit appear improve ability site.,4
4129,jenningsjanet@example.net,771.28,1991-04-12 10:10:41.152789,3,Stay similar front lose.,Ask watch leave evening first vote.,8
4130,williamskeith@example.com,598.5,2015-01-14 00:14:29.389000,7,Pick specific.,Member large actually Mrs bill. Music only season election thought right.,4
4131,hbradley@example.com,453.4,1998-10-07 21:35:25.113342,7,Improve record plant.,Understand international already cup speech race. Argue hospital he everyone popular.,4
4132,awinters@example.org,220.78,1974-11-12 03:11:30.216952,8,Size unit.,Serve down before night forget seven month.,2
4133,eric88@example.net,986.14,1986-04-28 06:06:14.494730,8,Simple might.,Ready sign leave wish operation order. Company car deep discover notice travel.,1
4134,hbarry@example.org,162.53,1973-01-27 05:38:34.412222,1,Go down.,Could big news idea glass develop. The he fine magazine cover.,5
