TransactionId,EmailId,Amount,TransactionDateTime,PaymentTypeId,Remarks,Info,StatusId
1000,jefferyfoster@example.com,98.14,2001-01-09 00:33:34.068464,8,Down prepare hear.,Sea task new. Per all million expert.,4
1001,hdelgado@example.org,490.42,1972-07-18 15:55:30.746113,5,High provide all.,Box do participant own continue season across body. Dog third report western agent charge.,3
1002,michaeljimenez@example.org,896.96,1997-05-18 08:15:59.506004,6,Security.,"Could every nature Mr short none bad.
Under hit easy. Despite so decide authority.",8
1003,emilywalters@example.com,896.25,2012-04-21 18:49:50.783370,4,Provide executive skill.,After player knowledge wonder gas enough. Parent peace describe these goal international event.,5
1004,soliver@example.com,748.27,1970-08-02 13:42:47.431541,6,Scene back.,Its particular analysis challenge court near address. Go fire pattern sing still drop.,6
1005,andrea93@example.net,200.81,1976-10-12 15:10:17.241058,7,Article include.,Method car seat start employee. Nearly water book development officer decision now suddenly.,6
1006,zunigapatrick@example.net,373.63,2007-02-28 17:15:06.752052,5,Field finish summer.,Available reveal important bed increase us itself. Of his quality mother almost.,5
1007,rasmussenvictoria@example.com,309.33,2001-02-28 16:42:07.712896,9,Build seek.,Probably door court space such. Outside will education question seem.,3
1008,stevebrady@example.org,363.69,1994-10-08 15:40:51.292705,2,Challenge already wall.,You management ago radio. Message admit actually force avoid I focus. Team necessary bad.,7
1009,tamarahanson@example.com,842.55,1982-04-25 14:07:56.108466,8,Ability not Mrs quality.,"Political myself western issue.
Single send seek shake there. Culture kitchen meet.",5
1010,sanderstracey@example.com,270.7,2011-11-07 11:39:37.266189,4,Skin prove not.,Part mention treat girl sport out yeah three.,5
1011,richardschad@example.com,65.66,1979-01-14 01:30:51.616957,6,Watch senior performance few.,Follow five century call goal. Could themselves protect spring.,2
1012,michaelbradley@example.org,458.31,1997-08-09 07:20:37.399852,5,Clearly street course.,Indeed foreign discuss senior. Thing yard suddenly ask later rest race. Color degree give attack.,7
1013,jennifer58@example.org,710.4,1987-12-25 09:48:30.228276,4,With provide why.,Happy fall fast party. Direction compare something college environment us board.,8
1014,robin71@example.net,355.58,1997-10-23 04:55:11.529419,8,Collection debate.,Education carry these senior magazine day eat something. That board whatever.,3
1015,adam40@example.org,260.99,2011-09-05 15:09:11.966406,8,Produce industry process present.,Really should center. Table begin often official mother. On someone career rich.,6
1016,tbryant@example.com,485.31,2007-07-01 23:09:56.205408,9,Off country American.,Would general very play wife raise short. But land parent ten. Outside go quickly upon well.,3
1017,brownvalerie@example.org,371.24,2023-10-22 21:09:19.554386,8,House his.,Five bed ground ready everybody threat. Shake place lot first history difference.,3
1018,andrea93@example.net,677.51,1992-04-08 06:42:15.890730,3,Picture what prepare.,Letter thought purpose collection green enter six church. General among word type may.,7
1019,daniel14@example.org,437.31,2020-01-13 02:38:41.014829,9,Perform point.,Network chair continue fish laugh probably court. Environment for either station cover.,4
1020,cynthia50@example.com,41.45,2014-03-21 17:16:19.836980,4,Help manager.,Experience with reason nature society key contain. Ability interview two describe.,4
1021,cynthia50@example.com,292.47,2015-08-13 09:33:04.542656,5,Help teacher baby.,Successful party red woman home skin. Task involve specific her seek less your.,7
1022,allensandy@example.net,318.5,1989-06-26 19:10:07.362977,7,Usually help rest.,Would professor instead toward require. Huge onto language amount anything against family.,3
1023,webbdonna@example.com,592.76,2006-03-26 18:23:35.716697,8,Return fund.,Yourself prevent third. Push support walk commercial. Training present sense risk from task.,5
1024,nguyenrobert@example.org,995.91,2010-06-14 15:06:45.238460,3,Federal provide.,Can difficult level writer sound address. To memory bag place interview nation.,2
1025,jamessmith@example.com,71.82,2005-08-08 05:47:53.552219,2,Forget strong network task.,Treat piece despite course moment clear cultural deal. Officer could fear challenge property.,8
1026,bgriffin@example.org,45.76,1993-01-27 05:23:53.994911,6,West baby enjoy animal.,Political indeed enjoy audience. Itself group will dog old often one.,5
1027,srodriguez@example.net,813.81,1996-03-04 18:58:55.992811,8,Letter life.,Financial whom least into go town. Task authority television hair available after future.,8
1028,ocarlson@example.com,712.26,2006-10-25 06:13:59.026897,6,Service reveal.,Talk enjoy camera. Worker full my final evidence. Increase do lead hot thought financial.,7
1029,haley20@example.net,103.52,1995-05-13 19:05:46.693776,9,Film serious.,Nearly sing process admit true here. Green region each. Free I it skin finally.,5
1030,vwillis@example.net,929.39,2017-11-13 14:19:39.018131,7,Place discover.,Dog about dream. American fight yeah generation style always do. Way deep miss.,5
1031,dawnbullock@example.net,278.49,2010-07-08 11:35:56.126888,1,Officer cultural respond.,Number whose season responsibility long laugh. Identify reality throughout defense notice just.,2
1032,nguyenrobert@example.org,280.71,1987-05-11 09:13:54.810124,3,Right cultural.,Either system create most about forget these. Art parent international.,5
1033,kbernard@example.net,207.69,1991-07-05 03:23:04.797474,2,Guy while space.,Way mean him move five end there late.,4
1034,michael01@example.com,387.43,1981-05-20 22:08:38.539050,9,Different.,Seat candidate news space drive sound. Light our future.,5
1035,bergdeborah@example.org,11.13,2015-03-04 10:58:53.690504,5,Government nation baby.,Voice source probably drive push almost. Say no large best region herself involve.,7
1036,michaelrojas@example.org,181.62,1989-05-12 12:36:28.806987,2,Most box kind unit.,Such option space other. Full government hope may. Explain our campaign.,4
1037,lisa20@example.org,785.0,1981-01-15 04:39:39.167443,4,Morning wonder writer.,Generation local economic tonight yard season. Machine audience one hand form pressure.,1
1038,olsenbrandon@example.com,638.19,1975-05-22 13:40:15.865120,5,Represent support.,Catch me while of. Them interview state.,7
1039,tayloranthony@example.net,788.29,2013-11-01 01:00:43.664450,6,Congress heart.,Great time recognize though evening.,3
1040,andrew71@example.org,242.34,1971-05-09 03:43:12.751762,2,Shoulder appear national.,"Happy arrive nor heavy evening.
Candidate home information network.",8
1041,bellchristina@example.net,634.99,1972-06-14 01:01:55.290837,8,Land event chair sound.,Store security gas authority mind such glass. Least meet choose civil same scene.,5
1042,ashleybyrd@example.org,648.44,1985-02-19 04:11:20.089391,3,More argue return.,Themselves focus democratic see Democrat purpose. Because field crime identify.,1
1043,solisvickie@example.org,296.87,1984-06-23 00:55:29.856901,6,Method office decade.,Agreement evening old decade reality hear street. Wall necessary heart. Turn there guess.,1
1044,jennifer49@example.net,776.36,1975-09-13 22:15:11.224116,4,Wife stage.,"Claim there authority really game stand.
Off father note pressure.",7
1045,oedwards@example.org,368.65,1991-01-09 20:37:25.959000,2,Real from.,Day program whether future standard feeling often. Very step skin provide hope add window.,6
1046,matthewscharles@example.net,674.76,1981-03-07 21:55:59.371857,2,Pattern minute coach.,Season simply sell. Film resource lead specific.,6
1047,deborah64@example.net,690.15,2001-09-30 00:15:07.630810,3,Art cut.,Big better clear woman career sometimes professor without.,6
1048,shurley@example.net,120.58,1973-01-15 21:24:50.792384,6,Show space.,West skill blue religious more center end. News television know amount else idea.,4
1049,james77@example.net,723.63,1981-12-19 07:01:44.095902,7,Lead.,Firm between show traditional. Student speak professional common network determine fact ready.,4
1050,william12@example.net,588.08,2022-07-18 01:25:15.298148,4,Medical beat.,Go clearly safe could reduce firm.,7
1051,graycarla@example.org,61.12,2000-11-28 04:56:30.314454,3,Such series.,Measure result him stop form goal. Interview truth nation either. Cup agreement culture good.,8
1052,lawsonnathaniel@example.com,483.73,2014-02-08 00:48:55.463772,5,Enjoy dinner.,In threat about sound. Development decision sea possible share significant design.,3
1053,owenmichelle@example.com,32.48,1988-10-31 06:34:04.234030,8,Billion condition.,Camera certain serve couple score share also.,3
1054,francisco31@example.net,728.24,1986-05-14 07:53:23.286875,7,Task.,Purpose whom then. Music top fly speak possible region example. Become form image.,5
1055,qthompson@example.org,15.51,1971-10-19 20:35:26.087543,9,Nor receive.,Place eye body. Doctor these according name though guy. General give source want series.,4
1056,ycook@example.net,344.33,1982-04-11 10:23:39.750662,1,Career.,Set service condition significant stage. Pretty task care free prevent raise long.,5
1057,david43@example.org,629.52,1979-10-06 15:23:29.419678,1,Push.,Explain appear community ever. Fact actually little good everything various.,4
1058,veronicamitchell@example.com,56.57,2010-11-27 10:28:10.055060,5,History film me.,Would many local. Wind parent respond ever method paper computer.,5
1059,stanley35@example.net,881.01,1987-01-25 12:34:47.129760,9,Study number drug.,Health me hour. Eye agree marriage short suffer. Star behind paper building now space pay.,4
1060,brownandrew@example.net,47.32,1981-12-29 09:02:17.945998,8,Drug certain short.,Spend because color born music or. Wait data pass positive.,1
1061,mariemoore@example.net,212.46,1981-07-31 19:39:35.183716,9,Amount probably.,Everyone parent second. Common special majority issue stock. Nearly choose recently protect he.,3
1062,malik41@example.org,278.41,1988-10-08 03:17:33.686213,6,Leg those.,Pressure election service interview environment same. Investment laugh true true. Forget fight yet.,4
1063,wtaylor@example.org,887.83,2005-06-09 11:53:13.630516,1,Process open.,Address avoid may choose. His science goal without already.,5
1064,barbara32@example.net,265.98,1986-11-10 10:27:37.362672,7,Develop head find.,That building candidate authority itself material thus. Where modern year form let.,1
1065,fponce@example.com,397.18,1996-07-02 14:02:28.351781,9,Technology black similar.,Finish friend hear. Be tax lot something information. Recognize instead least thing.,8
1066,bhart@example.com,178.19,2010-03-28 13:32:37.271710,3,Trouble newspaper world.,Politics modern full. Modern offer read central.,7
1067,whitakermichelle@example.net,247.42,1985-12-02 05:13:24.709336,3,Bed arm goal discover.,Few marriage certainly nothing whatever.,7
1068,allisonbishop@example.org,889.48,1976-02-02 02:02:43.833987,4,Tree unit against.,Class rate weight activity. Kitchen kitchen feeling while want claim worry.,6
1069,smithvictoria@example.org,457.02,2019-02-01 12:39:47.568221,5,Small popular.,Today certain range candidate economic. Tree stage population institution.,8
1070,brian25@example.org,841.72,2019-04-13 17:23:56.413328,8,Administration we station quality.,Thought skill always range.,8
1071,jacobrhodes@example.org,350.91,2016-08-22 22:39:53.338437,3,System.,Leave southern front decade toward. Everybody change show approach.,4
1072,ebryant@example.org,128.68,1999-01-02 11:48:17.454151,9,Study spend.,Build behind reach media attorney leave. Attention development in sit radio. Forget loss of.,3
1073,brios@example.com,453.86,2017-11-19 23:38:49.450045,8,Single.,Group bar dinner college talk range. Tax seat notice turn star.,3
1074,michaelbradley@example.org,148.18,2015-07-13 01:46:31.907603,7,Return sometimes.,Sit such bill yes public gas article. Believe clear word short glass.,5
1075,alejandro29@example.net,105.64,1991-04-01 09:14:14.437145,7,Director them money he.,Hear simply American trade once really field. Sound oil father peace.,3
1076,craig74@example.com,744.78,2016-07-31 12:38:25.346792,1,Money go.,Not become over week reflect. Note better kitchen social.,7
1077,joshua42@example.net,826.93,2014-02-01 03:50:35.565797,2,Professor turn Mr.,Quickly large forget cause box court animal lay. Art never have sometimes big.,5
1078,smithamber@example.com,137.56,2002-12-30 22:46:29.453216,9,Budget shoulder.,Administration room reduce program activity. Expert Congress marriage message far admit.,4
1079,creed@example.com,969.53,1989-04-22 14:38:27.596666,9,But.,All everybody this participant. Read term brother understand money eat beyond word.,8
1080,saundersloretta@example.org,942.01,1997-05-30 14:44:48.678379,1,Mind physical stand.,South either size each almost wear pay. Camera continue page mind door matter. Word region time.,8
1081,kristinavalentine@example.net,661.5,1976-11-16 22:23:45.150540,9,Soon and material.,"Line listen cup detail.
Other cultural imagine expect woman expert. On rest daughter picture trial.",4
1082,angela70@example.com,239.02,1990-10-14 14:09:35.023061,8,Loss.,Wrong just development talk rather western commercial most. Early listen year.,7
1083,alexiswong@example.com,91.87,2004-05-18 16:01:23.077683,8,Evening low.,Ok drop coach.,7
1084,carlosthomas@example.org,142.41,1982-11-05 17:15:51.170915,6,Doctor trouble.,True miss majority cell reveal evidence toward. Visit position lay budget over off.,3
1085,sabrinalewis@example.org,604.44,1970-12-24 17:55:41.926424,8,Prevent large range.,Social sit able several tax. Choose religious thought guy thought need wrong.,6
1086,katherine20@example.net,311.37,1995-08-16 02:18:36.407596,7,Cold work quite.,Ever international threat threat from. Fill somebody happy. Speak more discuss force.,8
1087,natalie33@example.org,88.59,2009-05-15 15:47:19.784301,2,Remain anyone anyone.,"Receive drug so difficult very enough federal. Rule none make.
Day her than home realize.",4
1088,hbright@example.org,716.03,2003-03-13 03:24:13.576932,7,Within person.,Media prevent person. Election small factor nearly exactly recently others exist.,5
1089,henry92@example.org,145.79,1976-01-18 21:26:50.980660,3,Realize sell they.,Weight these teach as answer popular rest.,1
1090,anthonybailey@example.net,440.34,1980-03-20 22:04:00.922283,2,Until today late.,Feeling world store skill study million. Child score cut state own.,1
1091,nicole47@example.net,468.96,1980-12-15 17:48:22.171355,5,Scene reduce represent.,Start others drug. Everyone west list. Still away each order front.,5
1092,courtney94@example.org,203.38,1972-03-13 08:45:15.860940,3,Room weight.,Mission ever how finally memory base. Soldier next practice hundred. Congress far for subject.,4
1093,michael48@example.com,873.67,2003-05-28 08:04:15.819944,9,Fall.,One light itself head poor friend. Present dog medical great low perform life.,3
1094,josecollins@example.net,962.43,2006-11-29 20:12:39.326192,7,Many full ten.,Couple environment treat discover us media number. Person two member begin part factor.,5
1095,davidbutler@example.net,487.59,2021-05-29 18:46:06.474170,1,Officer free.,Evening fear me maybe speech reflect. Although agree hospital figure. Window across me.,8
1096,william84@example.org,953.18,2009-07-07 01:27:22.756746,2,Stay.,Body may off memory. Impact fly western.,3
1097,wilsongabriel@example.org,272.36,2016-04-28 20:53:26.014554,3,Serious argue something.,Open including design everybody great ball where. Spend she new.,2
1098,vwillis@example.net,820.29,2008-12-30 09:12:27.211411,4,Between reach buy.,Production million best more knowledge process. Present soon often common president feel next draw.,1
1099,anna90@example.net,457.1,2012-01-30 22:47:22.296795,2,City later letter.,Couple occur away. Anyone live impact dream work. Necessary last until oil form story fish.,5
1100,amorgan@example.net,329.08,2008-11-08 13:48:46.486141,9,Worker another.,Miss cultural discussion staff less. Garden thing purpose system.,2
1101,juliajacobs@example.net,665.16,2011-07-08 05:27:07.993844,3,Begin world last.,Part theory his role because. Follow design nor.,4
1102,ymendez@example.net,31.2,1985-04-17 22:41:53.388581,9,Note federal.,Probably build bank member want trouble. Large himself from. Worker place himself everyone.,2
1103,grantamber@example.com,352.5,2000-02-19 22:38:04.001390,1,Hair by.,Develop well grow song coach body economic. Beat particular west away meeting.,7
1104,jenniferduarte@example.net,887.78,2021-02-17 03:59:31.902565,4,Threat catch commercial.,"Among get side language single.
Gas reason what song interesting he. Available mother offer theory.",8
1105,craig74@example.com,645.49,1973-01-26 11:11:09.968330,9,Idea one.,Commercial start sometimes. System degree reduce war new six hope over.,6
1106,mary22@example.net,914.27,2013-08-11 22:01:43.467474,6,Former high.,Air executive item interest traditional seem experience. Represent civil line make.,4
1107,dhill@example.net,188.3,2013-12-27 21:21:36.929550,3,Necessary attack idea.,Team hour really question system keep.,5
1108,nicole47@example.net,330.36,1971-03-07 04:45:31.643328,4,Might imagine notice.,Worker trade star month become discover. Mother society focus meeting.,3
1109,jodi35@example.org,414.19,2013-06-04 04:57:22.754524,6,Common.,So recognize baby key example. Also gun picture way up baby research nation.,6
1110,garciakatie@example.org,165.18,2002-06-30 03:38:14.814105,2,About audience choice.,Thus operation blue rich. Tv purpose bank.,6
1111,vhudson@example.net,386.44,2006-12-17 14:06:50.777134,6,Say ready surface.,When decide forget appear somebody. Type option trade thing continue door goal.,5
1112,allisonwilliams@example.org,116.5,2013-03-20 06:30:46.228562,1,Method left manager land.,Cold issue number sell program state. Process gas big consumer.,5
1113,gclark@example.org,146.72,1978-05-13 19:03:49.889267,2,Look nothing us.,Staff seem blood compare ago skill. His school challenge hundred around suggest if foreign.,6
1114,sandrafox@example.com,235.47,2023-06-20 05:27:04.356248,8,Foreign series always.,Far difference between system save I physical. Student traditional attention.,8
1115,melissa83@example.net,701.05,2012-11-24 18:54:46.958693,8,Race begin.,Indeed their minute over serve usually. Charge enter certain job lay knowledge name.,8
1116,darrenwallace@example.org,62.7,1993-04-04 09:07:30.441795,5,Future.,Worry over catch few her. Police public response remember little happy term.,4
1117,robin34@example.com,159.83,2020-08-14 06:53:45.277658,6,Fight with task.,Gun red and food fight. Others data staff customer reduce.,5
1118,meganthomas@example.com,989.18,1992-06-05 10:38:38.741351,4,A hair.,Mrs someone drug simple development risk large total.,5
1119,owenmichelle@example.com,403.39,2020-06-11 18:04:06.056904,5,Community skin guess on.,"Price officer prevent speak. Third whether economy few.
Direction man ten whose simple avoid.",3
1120,luis54@example.net,58.79,1993-01-30 15:15:24.168533,5,Image science.,Station phone worry. Game chance mean happy likely live. Writer color get soon never onto.,7
1121,leecrystal@example.com,160.72,1992-11-01 10:33:58.739380,7,Send mission.,Total others condition account require tough relationship. Upon yes scene close either.,8
1122,jeffrey52@example.org,89.22,1997-09-26 02:09:22.196670,4,Perhaps.,Science main who standard end effort. Something identify film practice through rich defense red.,3
1123,smyers@example.org,291.8,1974-01-31 11:07:49.323094,8,Explain recognize.,Audience sea risk fund. Around product stuff him.,7
1124,henry92@example.org,389.52,2020-12-23 22:28:31.744549,9,Look reveal including.,Six process like any especially condition young. Gas there nice our.,7
1125,kweber@example.org,443.43,1995-07-23 19:04:53.831590,2,Behavior say.,Moment south kind star consider property. Improve speech likely fine start.,4
1126,cindy68@example.org,510.42,2019-01-21 04:01:42.116191,2,Full in.,Organization back team million worker. History support customer option shake once should.,3
1127,freemantiffany@example.net,538.5,1985-06-08 22:45:50.564046,9,Every line.,Huge dream push word. Impact relationship interview doctor.,2
1128,phillipsthomas@example.org,831.25,2003-06-04 13:14:10.807608,8,Meeting join.,When film there sort. So cultural key market. Cover in me expect general indicate.,5
1129,lawsonnathaniel@example.com,887.68,1971-02-21 17:46:36.656068,6,Little hard early scene.,Suggest hour bit financial. Age ahead activity fund kitchen lead tend.,5
1130,freemantiffany@example.net,581.11,2004-12-22 11:57:21.145519,5,Small account sing.,Specific keep leader blood change reason both.,4
1131,bryan93@example.com,60.52,2015-12-07 12:06:23.973805,6,Middle top.,Happy early approach Congress movie federal. Remain political every second.,2
1132,brookegillespie@example.net,850.5,2010-07-16 16:31:43.063451,6,Growth interest.,Radio read few sort night. Part edge I certain small.,8
1133,ashleystephens@example.com,619.36,1991-09-14 13:04:55.298164,4,Property raise edge.,School executive movement good sometimes.,4
1134,joseturner@example.com,218.2,1992-01-15 14:58:12.351754,3,Drive radio could.,Level run do today billion. Part question myself mention stock during style page.,6
1135,bhart@example.com,815.88,1986-04-06 11:52:06.217342,7,Cause either.,Whom well receive speak. Picture return film fight hope program big.,7
1136,gregory35@example.org,177.93,1989-10-06 16:58:49.923823,1,Say report stock time.,Prevent guy unit out tend statement. Long case choice walk fast meeting.,8
1137,raywayne@example.com,911.75,2017-06-14 11:53:04.654910,2,Car lose.,Happy ever perhaps agent role determine. Change remain conference recent.,2
1138,dominique29@example.com,586.99,2005-08-11 23:58:16.868290,1,Become sometimes.,Company season plan. Soldier within take site yeah.,6
1139,hbradley@example.com,282.09,1975-02-21 10:07:36.328820,7,Stuff important.,First couple window couple. Tv its natural game.,1
1140,vhunt@example.org,475.58,1983-01-21 06:49:08.487993,6,Medical suggest wide.,Interview year where sound new security. Finally well be poor.,5
1141,alan71@example.org,223.8,1982-04-10 19:01:48.623834,3,Understand need.,Reduce sometimes type western affect. Contain quality system throw pull.,2
1142,tinakaufman@example.org,224.2,1970-01-07 22:50:18.243098,3,Lose tax.,Open purpose help air some. Business none sense. Per tell five usually political main.,4
1143,khernandez@example.org,373.09,1983-06-08 23:40:30.878745,9,System view.,Girl class court step only likely. Coach bad sing much any.,8
1144,anthony46@example.org,632.75,2009-01-26 23:14:38.632158,6,Country herself foot.,Control true and note TV. Fish what network.,8
1145,travisbrian@example.net,143.03,1996-05-02 15:19:25.095984,8,Medical drop.,Usually hand Mr them. Area media fill during.,3
1146,james34@example.com,501.57,1976-03-25 14:12:54.389442,5,Receive local.,Summer produce city worry yourself try watch. Budget value among and.,8
1147,allenford@example.net,339.17,2007-01-14 11:09:04.682846,9,Environmental serious develop.,Amount nearly myself effort. One might body reveal. On result offer expert over north who.,5
1148,leahthompson@example.com,402.73,1992-07-31 20:35:49.877338,9,Plan drop our.,Number daughter computer offer consumer reality.,6
1149,mweiss@example.net,677.39,1982-05-05 06:26:56.200880,6,Today west.,Suggest somebody season page air fly.,5
1150,fponce@example.com,89.38,2014-10-13 19:43:31.727220,6,Rate good school step.,Process fly participant nothing. Success send majority media stop site check.,5
1151,gabrielleatkins@example.net,83.13,1975-11-27 15:52:16.429558,4,Others skin then.,Nice matter form commercial bit. Republican why truth democratic stage yeah road.,5
1152,samantha13@example.com,151.83,1991-01-10 06:52:34.414551,5,Executive pretty guy.,Ahead game stock day require feel toward. Impact receive million save quite.,5
1153,ehardy@example.org,369.34,1994-04-19 12:11:03.435787,7,Wrong blue color.,Conference lawyer sing.,7
1154,wrightjesse@example.com,327.72,1979-02-14 06:54:01.725969,4,Do president difficult try.,Force north year economy kid game somebody. Law total public difference guy.,6
1155,lewisautumn@example.com,580.18,1975-04-10 10:05:45.360427,3,Often run get.,Pretty bill near blood avoid food single. Computer nation never point offer situation.,2
1156,allenalexandra@example.org,989.13,1976-05-31 12:00:51.439317,7,Grow like know.,Heart player sing month. Site technology door listen tax three.,2
1157,justin56@example.net,200.03,1984-09-16 06:43:24.230962,5,Care usually.,World new which kind enter time other.,2
1158,atkinsamy@example.org,832.19,2022-01-01 02:47:31.058473,2,Standard foot.,"Fill recent impact nothing. Put news beat.
Six religious bad hour note oil discover.",6
1159,natalie33@example.org,805.21,2022-06-07 00:35:55.238324,4,Car state trouble attorney.,Recognize young same. Environmental church fire live explain.,7
1160,markclark@example.org,963.09,1987-05-08 11:53:19.993624,3,Bad growth.,Movie who training focus score with. Among provide instead study.,1
1161,migueldavis@example.org,915.38,2019-04-20 20:58:46.899030,3,Two different perform.,White sort read environment natural. Scene doctor degree leave.,5
1162,urodriguez@example.com,560.11,2015-09-15 23:22:10.832819,7,Could become husband.,Feeling power billion argue. Turn themselves sport challenge yourself.,4
1163,roblesronald@example.net,175.25,2022-03-30 17:44:12.388851,6,Enjoy area investment.,Item site whether claim seven read result.,5
1164,alyssaglenn@example.net,99.83,2000-01-25 07:12:23.618862,5,As time.,Measure case issue hospital. Go decision actually whose mouth enjoy.,3
