TransactionId,EmailId,Amount,TransactionDateTime,PaymentTypeId,Remarks,Info,StatusId
1991,amandahampton@example.com,270.58,1974-05-16 23:49:37.611499,2,Boy hit.,Truth always listen meet mean discover. Under option strategy color.,6
1992,pbenjamin@example.com,90.84,1985-02-27 17:25:09.057570,3,Clearly food history.,Figure maybe off school. Service fill product to seven.,1
1993,haley20@example.net,627.63,2012-02-28 17:55:50.566677,1,Discuss trade federal.,"Church course campaign half remember others. Any sea way.
Rest action wind.",8
1994,ksmith@example.com,687.37,2004-12-28 08:59:25.020858,9,With give.,"Discuss later statement discuss my gun want. Way set return plant mention.
Training thus low yes.",3
1995,whunter@example.net,740.86,2009-06-09 18:25:11.779005,5,When then.,Practice inside sign represent civil. Teach call commercial entire.,7
1996,shurley@example.net,627.94,2005-05-17 19:00:17.247728,6,Key name last.,Case nation bag. Final pay hard individual. Else ball test.,2
1997,cynthiamills@example.com,978.78,2020-03-21 08:38:16.180147,4,Nearly different.,Edge music guy avoid piece itself. Program cell meeting nothing look.,2
1998,youngdaniel@example.net,326.4,2011-11-07 09:02:10.770329,7,Catch quite.,Foreign Mrs candidate heart thus mission. Save full cultural yes.,4
1999,davidbutler@example.net,701.96,1984-03-08 18:16:30.529952,2,Mr dream.,Television factor camera physical. Situation age enough these senior until movement black.,5
2000,parksbarbara@example.com,47.49,1988-08-25 10:43:16.771088,8,Enjoy head gas.,Consumer prepare note old recognize. Agree grow drop which. Painting student office stay.,1
2001,thomas01@example.com,371.54,2000-03-24 19:04:57.238910,1,Memory general glass.,Lot although avoid keep sport husband. Security suddenly how just certainly system.,4
2002,jennifer58@example.org,275.3,2000-10-27 08:47:28.532947,9,Behavior piece.,Several technology blood four fall. Continue thus TV.,4
2003,josephmartinez@example.com,190.95,1993-08-20 10:36:54.262312,5,Now lead other.,Suddenly yet their similar animal life. Office unit myself enough cover development area.,4
2004,matthewramirez@example.net,590.68,1975-04-20 14:19:02.171461,1,Current several police.,Room picture citizen push hotel. Plant many professional including thank risk.,4
2005,barnesjeremy@example.org,87.39,1995-01-17 16:45:59.451425,1,Voice already.,Join fish choose people.,6
2006,cheryl86@example.net,744.93,2003-12-14 02:14:07.386519,2,Great week often.,Suggest newspaper range window by federal. Shake table happen tend near test.,5
2007,hoganjohn@example.org,127.28,1990-04-08 11:10:37.779080,7,Economic research.,Anything similar live year. My though million poor. Rest stop itself news toward.,1
2008,angela67@example.com,911.65,2017-12-13 12:49:55.552922,1,Size also.,Will child need remember. Computer situation benefit capital alone seven.,6
2009,ewhite@example.com,961.98,1999-02-08 20:25:44.114907,6,Heart use space.,Democrat color break develop any.,4
2010,lwelch@example.com,533.38,1999-12-09 06:32:58.960834,9,During question arrive.,Media many attention present several opportunity. Student generation address friend thought former.,5
2011,david43@example.org,804.51,2018-01-31 06:51:02.087193,6,Take central.,Method bag value as factor card firm. Blood production building others professor.,2
2012,christopherharper@example.net,552.52,2021-10-11 10:33:18.189138,4,Approach simple tell.,Phone spring meet positive example study. Thus whom east alone always later receive.,5
2013,benjamin00@example.net,606.31,2019-06-08 12:52:42.537508,3,Strong opportunity force.,Name former catch quite between social family. Support early system great space.,6
2014,kbernard@example.net,183.67,1984-06-23 09:17:00.461437,5,Modern energy information.,Trouble peace approach back relate film. Tv least dark plan family since.,3
2015,darius38@example.net,149.96,1976-05-25 01:52:16.575238,1,Finally seek music.,Eight office service result the party vote present. Bag water trade.,8
2016,raywayne@example.com,688.74,1997-01-14 18:26:57.261508,5,With pressure old.,Air under like. Natural always sister behind career. Example movie better today ability.,2
2017,fevans@example.com,435.01,1996-06-15 04:18:37.857613,6,Employee wonder do.,Doctor buy worry hot. Carry myself beat response level visit minute. Scene just of past benefit.,8
2018,stephaniewright@example.com,663.88,2008-10-29 21:46:23.180049,1,Week out.,Education produce often among oil clear who. Material buy teach. Just product boy down.,5
2019,jimenezbryan@example.net,358.63,2003-01-26 23:56:43.562573,8,Learn beautiful.,Card firm pay end step draw.,6
2020,annwilliams@example.com,133.11,2008-11-30 23:33:23.662215,4,Stock doctor.,Defense rest inside great cell Congress. Them station defense part wind. Rich respond and idea.,4
2021,pittmanjohn@example.net,71.63,1996-06-26 11:22:34.576252,1,Step safe.,Do husband discover. Yet hot whom hand simply.,5
2022,rogersgregory@example.org,715.2,1974-06-03 13:00:18.998099,3,Scientist art responsibility.,Across likely building trip. Rock water smile trade floor student expert.,3
2023,tbryant@example.com,525.18,2022-04-07 07:28:57.780233,7,Respond seek identify.,Market stuff choice visit scientist. Me answer total service door put contain travel.,3
2024,catherine87@example.com,537.06,1976-03-31 18:52:37.337179,6,Big audience.,Situation if score prove dark car drop something.,1
2025,garciakatie@example.org,118.82,1983-02-11 22:06:32.255013,4,Safe structure.,Full front season chance hear officer.,5
2026,sarah58@example.org,463.16,1971-07-02 03:07:21.151311,4,Project watch single.,Into next official stand lose. Growth suggest guess pull central three some enter.,7
2027,smithmary@example.org,465.78,1993-06-29 19:21:11.096339,8,Full home left.,Activity miss treat enter operation within floor. Bad moment group value wide live sport arrive.,2
2028,shurley@example.net,15.57,1995-04-26 08:26:38.017741,9,Light should.,"Small drop hold concern entire born industry class.
Range article open cover head high.",8
2029,loretta05@example.org,601.63,1999-07-26 21:19:04.655993,3,Here wind.,Argue month rock look doctor raise serious. Project everybody newspaper during region.,2
2030,carlosoneal@example.org,646.55,1976-03-07 19:20:20.322236,9,Attorney skin morning.,Fear administration film cup social nor same focus. Mother Democrat situation close write.,3
2031,braunalicia@example.net,353.28,1974-01-25 11:56:12.501428,6,Husband meet man foreign.,Like common beat prepare certainly. Far sense thought any sometimes knowledge determine sure.,6
2032,braunalicia@example.net,218.01,2007-09-24 10:36:51.254314,7,Item thus where.,Them although front bring.,5
2033,kenneth45@example.org,708.14,1985-02-17 17:31:47.238560,3,Chance increase some.,Author very her describe news plant. Sing cut performance building computer age might.,6
2034,veronicamitchell@example.com,361.14,1994-12-07 02:19:57.789888,1,Yard simply.,Usually attention save according recent wrong growth. Society himself pressure investment ok.,7
2035,emilyfrazier@example.com,41.87,1998-06-06 01:17:00.414614,8,Truth never everything.,North trip third list manager. Able either simply.,5
2036,jcastillo@example.net,566.63,2007-06-26 06:14:33.386578,6,Picture head life.,Think popular imagine. Say fire network air.,5
2037,ericjones@example.com,514.23,2000-03-02 02:00:23.360455,7,Professor couple.,Table score sure seem ago. Real husband million personal during.,4
2038,gregoryvictoria@example.net,961.98,1974-12-19 13:35:45.431889,8,Career save prove.,Up order record modern.,4
2039,james77@example.net,227.73,2020-07-02 15:57:05.942074,2,New fish.,Not well this. Partner something commercial whom.,4
2040,wesleycosta@example.org,555.86,1992-04-01 10:38:58.558275,1,Above order fire.,Still kitchen old agree. Or many company heavy create.,7
2041,ostrickland@example.com,300.66,1988-10-20 15:13:07.160096,4,Picture already deal.,"Sound state try huge. Reality value movie couple.
Change light crime edge would today beyond.",8
2042,catherine33@example.com,925.24,2014-04-24 00:25:45.369258,8,Boy value business.,Arrive young whether company direction top majority.,6
2043,xyoder@example.com,638.13,1997-06-02 14:50:16.349443,2,Make bag.,Follow movement wait west same small. Economic serious write campaign trial suggest.,5
2044,greenethomas@example.org,65.08,1971-04-18 23:00:50.987653,7,Toward method full.,Entire prove TV city.,1
2045,maureen19@example.net,552.1,1987-04-30 19:06:33.907352,1,Somebody already.,Not agreement size while probably something. Growth specific face material themselves enough.,6
2046,uwalker@example.net,850.23,1989-05-21 21:13:06.810670,6,Peace travel support.,Next each remain admit wide. Serve they lawyer so.,8
2047,ronaldreed@example.com,326.29,2021-06-07 00:17:51.965025,4,Anyone water.,Level spend trade.,4
2048,ycook@example.net,369.66,1988-12-28 11:09:08.405902,3,Although.,Relationship help themselves dog become first. Discuss majority beautiful might south.,2
2049,lwelch@example.com,768.4,1990-10-10 06:31:05.544918,5,Bar hand half.,Each sure social alone above.,2
2050,barnesjeremy@example.org,639.93,2007-01-07 11:08:16.699592,3,Remember magazine friend.,Civil head land central nation upon enjoy. Government think give.,5
2051,downsjesus@example.org,510.97,1972-08-04 17:14:05.502053,8,Our he upon suggest.,However behind real hard decade among order four. Most teacher region bring leave.,3
2052,schwartztammy@example.com,232.69,1973-06-04 16:19:07.714956,2,Animal specific class little.,"Win girl bad land throw focus.
Season cut husband share thank attorney.",6
2053,xdelgado@example.org,166.77,1987-01-04 07:29:37.609920,3,Trip chance well.,Drop computer statement choice model. Threat attorney fact.,8
2054,tayloranthony@example.net,343.85,1977-07-02 08:38:25.215962,7,Someone race number.,"Else onto he amount best once. At plan bank.
Before which information recognize good.",6
2055,tmartinez@example.net,662.48,2010-07-18 04:50:28.661676,7,East yourself.,Two they hit. Different single outside school. Base strong account person join.,6
2056,jacob48@example.org,481.1,1975-01-23 17:40:36.655230,7,With charge.,Treatment prevent international morning wind. Try reveal make site. Area activity quite wrong.,6
2057,bfrancis@example.net,255.07,2020-03-20 22:22:54.575906,7,Later.,Including include board do audience. Common standard develop throughout.,2
2058,hunterthomas@example.org,915.61,1977-10-16 11:46:46.240433,5,Possible well give.,Cell main question mother protect child. Financial I carry expect mind.,6
2059,brandon95@example.org,974.44,1976-01-16 16:28:14.061546,1,Would assume.,Mrs store perform political husband religious follow.,3
2060,ymitchell@example.net,607.05,1984-02-29 09:30:57.343571,4,Board live government.,Quite dog participant television education you. Power fight cost customer miss ever.,8
2061,christine67@example.com,615.86,1975-04-22 09:13:37.917342,1,Loss amount audience.,Year guess clear provide never across own.,3
2062,michaelbradley@example.org,107.54,1996-04-01 06:41:23.100941,6,Hospital clearly.,Throw past money. Account trouble fear affect conference political. Yes rather home line condition.,7
2063,dpowell@example.org,271.42,1984-02-21 19:31:17.516437,5,Step trade.,Section by compare my land me school couple. Read reason always understand police put.,8
2064,edwin95@example.org,947.36,1986-09-08 21:23:29.865047,1,Whose brother probably.,Everyone leave board rest. Else kind idea season religious son then. Agency thousand born state.,2
2065,johnsoncourtney@example.org,371.87,2018-12-10 04:05:52.447370,4,Something federal.,Author possible teach thought three both possible. Body draw spring professional mean.,1
2066,rsloan@example.com,833.65,1991-07-13 10:18:56.840139,3,Range close blood may.,Challenge collection under age. Should soon can the late major remain.,6
2067,krystal04@example.com,152.84,1997-07-22 19:34:42.943951,3,Wish indicate.,Protect though require let shoulder. Bad pay foreign evidence your from seat popular.,5
2068,smithmary@example.org,123.43,1990-02-27 16:45:28.699164,4,Site item white.,Compare people fire ago long. Try serious size interest of.,1
2069,juantyler@example.net,616.7,2012-09-30 03:51:51.905683,5,Design enter.,Task design figure leader under report reality and. Pull know south just learn serious.,7
2070,juliemccullough@example.net,941.3,1981-02-19 03:53:30.426063,6,After industry now.,Movement shoulder hair officer writer against perform. Line various the follow.,3
2071,nguyenandrea@example.org,485.08,1973-07-12 14:18:37.977503,4,Management far knowledge.,Successful remain customer everything can goal training each. Choose write once me. In bank team.,6
2072,alexandersellers@example.com,251.77,1981-05-25 19:16:46.172178,4,Politics all.,Certain strong religious reveal allow attention when. Human clear Congress remain become.,3
2073,soliver@example.com,428.54,2002-06-22 15:25:28.607490,9,Radio other month.,Do through agreement defense career suggest still. Bar dog short quite check hour add.,3
2074,vburch@example.org,671.98,2014-07-25 20:38:40.665279,5,Positive instead effect like.,Pass foreign among. Probably base new away above professor.,1
2075,bcarter@example.org,868.45,2000-07-16 04:10:34.196544,2,Tough energy last.,Both cup move look ahead can often. Style hear herself. Movement seek marriage push camera.,2
2076,thomaswendy@example.com,338.52,2019-05-13 04:34:54.197973,5,Everyone street.,Democratic defense house those room close. Leave bill than rock front determine.,4
2077,petersonchristine@example.org,105.51,1987-09-22 22:35:20.154181,8,Act risk town.,Choose build live amount. Bill last provide forward better threat international education.,8
2078,hdavis@example.net,539.59,1981-01-20 04:11:24.837138,5,Budget organization treat.,Assume crime question.,8
2079,alexanderjeffrey@example.com,176.71,2015-04-04 06:44:17.585795,7,Two his go.,Same image poor. Hope recognize program.,6
2080,stanley35@example.net,164.85,1973-10-29 22:51:47.138141,5,Wear top.,Entire reach for finish. Enter cost growth president rather anyone.,6
2081,padillachristopher@example.net,140.03,1986-12-06 17:25:47.822160,8,Site significant.,"Seven time describe manager.
Where specific listen its from.",5
2082,elizabethpadilla@example.com,634.57,1998-11-03 08:54:32.407795,6,Four city.,Tend name star art power enough dog. Ten design expect subject.,5
2083,michael15@example.org,771.14,1982-11-01 03:34:15.273355,6,Guy bill.,Other a will ever. Whose first possible run.,1
2084,mcgrathrichard@example.org,129.6,2010-08-13 12:09:58.106988,8,Once join doctor trade.,Fire require unit life second guess majority. Hundred manager also cup stock guess.,2
2085,cynthia07@example.com,323.87,1989-10-08 20:06:24.895483,7,Official never who.,Then relate area team student do. Power item idea must price.,7
2086,popesheila@example.com,274.51,2010-06-03 23:48:15.311863,4,Catch letter stop.,Model try feel country activity. Generation fall focus them design pay.,2
2087,riveramichael@example.net,945.05,1976-02-23 11:36:29.222611,8,Film similar.,Send seven method win yourself analysis. Me size street focus animal.,2
2088,allenfrye@example.org,288.21,2017-08-21 12:07:25.499894,3,Of call.,Others act cover relationship. Relate sound to mention. Mean collection it impact dark.,4
2089,sandra69@example.com,970.19,1976-07-10 07:04:33.637434,6,Role professional though.,Official instead along positive before. Vote language way cost pay.,8
2090,martinpierce@example.net,733.1,1992-04-26 21:24:16.928366,1,Far special enough.,List capital other site blue. Mrs behind everybody official.,8
2091,wilsonblake@example.org,514.06,1978-08-29 05:21:08.073738,5,Not third data.,Begin our certain wide either bed if. Doctor full mention billion true. School again hotel or.,4
2092,allensandy@example.net,552.83,2022-11-16 20:14:07.234620,7,Office.,Rule office hospital debate there. Should accept say church head.,5
2093,yrobbins@example.com,975.46,1985-05-01 21:08:38.703540,4,Suffer find.,Heavy spring theory become. Mean industry value similar meet stay.,6
2094,wrightjose@example.com,83.8,1977-09-22 09:43:31.117832,6,With bad future.,Water add region inside. Certainly than table public usually game focus.,5
2095,sneal@example.com,842.47,1995-01-15 07:33:42.061589,7,Adult data executive sister.,Professional job answer understand. South street when respond.,4
2096,greenemichelle@example.net,504.63,2002-06-29 01:01:59.871098,4,Research effort.,Chance painting participant recent. Pick have north exactly no modern.,8
2097,cardenaschristine@example.org,553.37,1978-06-06 05:13:02.923326,4,Page.,Democrat whole during consider seven wrong own. Relate can quite into.,2
2098,petersonchristine@example.org,640.69,1998-06-24 09:33:54.412069,2,Those hear center.,Fall everyone police reflect. Vote drop growth week energy result.,2
2099,angelamurillo@example.org,324.98,2005-12-23 00:36:34.685403,9,Administration ago involve.,Establish by area example. Recognize herself leave both bring.,8
2100,johnwebb@example.com,515.94,1984-12-09 03:50:48.667639,6,Decision magazine there.,Black attorney take there. Size agent play add.,3
2101,vwillis@example.net,605.37,1977-02-04 08:35:30.505833,3,Court keep.,Range enjoy identify.,4
2102,alexandermills@example.com,938.18,1980-09-02 00:15:37.860557,3,Raise until sense while.,Name generation ok save relationship. Seat you fly start.,5
2103,sandrafox@example.com,430.64,2022-12-05 23:46:06.853041,6,Myself stage beat best.,Perform material west agent. Time talk week maybe represent.,3
2104,smyers@example.org,812.61,2001-07-25 10:11:27.746946,5,People source we.,Always sense meeting third care exist once. Several range strong young.,7
2105,wtaylor@example.org,180.27,1980-02-16 07:46:05.144569,5,Include now.,Know here near create economic same. And international respond growth this around evening become.,6
2106,ronaldreed@example.com,763.36,1990-06-01 13:08:14.940261,1,Home notice.,Friend occur win lay get produce worry.,7
2107,pmosley@example.org,674.93,1977-02-25 11:02:19.615562,3,Most win behind.,Owner dream for throughout. Middle moment system.,1
2108,anna90@example.net,108.61,2017-08-02 12:11:17.116771,4,Institution economy.,Fly everybody north former soldier. House view American yourself century.,8
2109,tjohnson@example.com,89.69,1999-07-18 15:39:29.517679,9,Realize least small.,Research law class occur summer serious. Traditional outside agency toward unit.,6
2110,anthonybailey@example.net,782.66,1995-06-23 08:51:08.755840,5,Simply protect fund.,Difficult reflect player kitchen participant. Class get feeling organization.,1
2111,mcgrathrichard@example.org,979.95,2012-01-04 02:49:13.573943,9,Set quickly.,Speak current fly need. Decision organization bed fire quickly item music. Different yet end so.,1
2112,christopher23@example.com,165.88,2011-10-24 12:08:59.953691,2,Current pretty.,Already seat successful pass whose. Available check step tend record end. Dog common water.,8
2113,wellsmark@example.org,830.91,1974-04-18 09:27:42.509901,2,Live tell.,Affect of wish add skin four. Walk report across study thank really.,8
2114,daniel27@example.net,87.13,1992-05-05 00:41:34.186354,3,Sit war.,Owner to provide then inside particular probably. Type him early recognize book build.,7
2115,davidthomas@example.com,566.61,1970-11-05 04:08:52.638647,3,Institution long imagine.,Mind tough care tend best. Call language special director. Whose question trouble bank.,3
2116,jdelgado@example.org,195.69,1975-02-01 14:28:42.342136,9,Season trip them financial.,Long peace blood all series boy. Perhaps allow job investment team.,6
2117,michaelharris@example.com,341.16,2006-02-28 13:10:14.927870,9,Night security level.,A small food item decide. Line paper boy wall explain she structure.,5
2118,qdelgado@example.net,574.4,1977-07-22 02:22:23.208191,4,East wide.,Thing five could front field line. Treat over line spring player culture challenge.,7
2119,jgarcia@example.net,281.06,2015-08-27 16:55:19.807432,1,Director though.,Bring general radio figure market. Beat suddenly above attack him.,8
2120,martinjanet@example.net,513.31,1982-10-15 02:51:49.741750,9,Idea fire.,Decide loss sing away television say book. Chair rich now article national also.,5
2121,elizabethwheeler@example.net,982.26,1989-02-12 14:05:12.948676,9,May woman.,Party economic out father technology benefit. Student note feeling space.,6
2122,molly60@example.net,715.95,2000-11-12 14:15:17.788664,9,Simple.,"Tough will three arrive.
Road term consider voice.",4
2123,anthonybailey@example.net,535.02,1976-05-13 14:01:07.633294,6,Stop nation worker.,Discover win although. See say company thousand item bank because. Sort husband religious body.,6
2124,sheilagomez@example.com,277.2,2008-08-04 01:45:35.972263,7,Ready quality.,Certainly wide she across happy black most laugh. Concern health pay south time.,5
2125,migueldavis@example.org,229.12,2013-01-06 11:38:04.437757,6,Special strong play.,Responsibility music local Democrat. Military property western director.,7
2126,clarkdanielle@example.net,503.43,1973-10-19 20:27:22.365050,5,Early election.,Able price money happen left break. Dream degree energy develop not available.,4
2127,xboone@example.com,353.85,1988-03-19 01:51:48.659742,4,Change scientist next.,Three improve you structure discussion. Send site manager.,8
2128,jacksonpatricia@example.com,929.66,2017-03-16 16:49:24.096915,7,He more reason.,Step guy minute paper win even language. At feel range activity.,3
2129,qdavis@example.com,698.2,2010-04-14 21:27:45.380233,8,Join walk.,Hit though fear evidence stage. Visit peace network more arm. Build significant just father phone.,4
2130,kweber@example.org,204.93,1978-06-20 01:41:00.550147,2,Production grow either.,Offer doctor entire have smile. Form base yard.,3
2131,dianahaney@example.org,436.98,1998-01-29 23:43:56.861894,1,Serious ten.,Ok figure soon animal. Republican history natural form hundred baby. Very fire maybe.,5
2132,jeffreyblack@example.org,373.1,2009-11-13 02:22:57.309721,6,Professor people.,Allow institution Republican I far eye. Behind ago item receive society both hear.,4
2133,dianahaney@example.org,477.16,1971-07-21 01:35:20.807512,6,Reflect certain want.,Investment news expect generation ten effort. History American bar main upon population start.,2
2134,daniel14@example.org,184.62,1981-05-08 21:41:03.523085,3,Chance meeting.,Whole feeling imagine. Near which story peace. Life per live generation.,1
2135,johnsondavid@example.org,803.86,1981-09-11 10:39:53.229371,8,Space couple.,Leader current effect go son popular. Federal wall city why. Candidate buy different positive.,7
2136,russomatthew@example.org,553.94,1998-08-10 19:54:43.909505,2,Main within property.,Believe hotel develop direction if. Fill eat wide analysis.,7
2137,slewis@example.net,255.8,2011-11-24 10:29:14.876486,2,Choose suggest.,Approach better social state Mr. Doctor different second challenge responsibility economy.,8
2138,olsenbrandon@example.com,970.63,2023-07-06 15:17:52.203552,2,Look.,Trial seek a piece minute. Great north the might meet in. Keep guess from.,1
2139,robertrivas@example.org,45.62,1974-08-16 23:41:49.956451,1,Upon baby yes.,White somebody seat special technology reduce.,2
2140,teresa77@example.org,899.17,2010-11-05 04:50:22.576703,4,Past sing few.,Town name food because statement give. Baby and nor.,7
2141,robertrivas@example.org,706.66,2021-11-14 03:37:18.757711,7,That knowledge.,Fight language analysis fire above final dream. Mr out fear kitchen Democrat.,3
2142,steven77@example.org,183.14,2005-06-20 22:49:39.919835,7,Staff benefit.,Anyone care happy. Enjoy always specific listen old.,5
2143,cynthia50@example.com,827.12,1983-09-22 21:54:58.771032,8,Someone pattern American.,New teacher ready able that get. Animal quickly politics positive this perhaps page.,2
2144,powellmark@example.org,152.64,2021-09-08 00:07:58.486181,5,Yes mean safe.,Ago their size could cold individual. Certain you for case note fear right.,5
2145,matthewramirez@example.net,432.01,1974-11-25 07:03:19.132677,3,Hope so example.,Between success song view indicate.,8
2146,johnsoncourtney@example.org,197.78,1987-09-06 05:06:54.945494,6,Protect leader college.,Item stand film cup book. Through TV skill reality. Important media offer design smile.,4
2147,nicole47@example.net,224.03,1973-06-28 21:47:24.974082,7,Stuff according.,Church risk second reveal either against worry system. Theory media economy million lot.,1
2148,fgonzales@example.org,793.25,1981-10-15 02:55:50.285663,4,May design.,However myself physical this. Themselves be happy. Future both do.,3
2149,christopherharper@example.net,805.44,1987-09-22 02:50:15.105594,8,Risk order.,Cold line risk or hit indeed bank leg. Walk carry star fall range.,6
2150,parrishamber@example.net,446.05,2006-12-24 18:50:01.810302,9,Than each year.,Order coach myself. Service service set music suggest main. Who box fine hope.,7
2151,joseturner@example.com,315.03,2013-11-28 08:43:52.909156,3,Moment hour reflect.,Realize until call last movement recently people. Sit should body. Have guy approach spring piece.,6
2152,christopherharper@example.net,808.86,1975-10-26 00:18:53.371077,2,Development look win.,Join sister single chance hold full. At pay really. Process enjoy though they research.,3
2153,jmorales@example.net,914.26,1972-03-01 05:57:10.596592,3,Magazine generation chance.,Trial I east often still. Different tough feel street language most glass.,6
2154,millermaria@example.net,677.36,1994-06-14 02:30:50.922070,2,Nothing daughter mouth.,Start teach their consider great word art.,8
2155,braunalicia@example.net,126.71,2015-01-10 23:51:03.409497,2,Red different.,Small parent capital herself population true. Size write bag soon memory shake Republican most.,8
2156,andersondeborah@example.org,989.25,2010-01-08 11:00:45.423200,9,Prevent note.,Gun opportunity wonder know. Whose Mr to brother factor hard authority.,7
